paperID,title,citations,year,conference,last_updated
aef4cbf2957453c78de39a05b3205c0d1cbc5e6e,Solving graph compression via optimal transport,10,2019,NeurIPS,02 Mar 2022
aef8d07d3c229ff60b4bb257f69df47b829eb17b,Self supervised GAN Analysis and Improvement with Multi class Minimax Game,36,2019,NeurIPS,02 Mar 2022
af0410c19c21194541cc1976c76d8b666e64f257,Privacy Preserving Q Learning with Functional Noise in Continuous Spaces,14,2019,NeurIPS,02 Mar 2022
af143318f1a00040e7ff29708f4fd815692619b8,Fair Sortition Made Transparent,1,2021,NeurIPS,02 Mar 2022
af1765c5fa55a13f33bbca91a73c9e93d77b6056,Batch Renormalization Towards Reducing Minibatch Dependence in Batch Normalized Models,319,2017,NeurIPS,02 Mar 2022
af1effc5073caf51f958e749928a1d0d3eb96539,Co regularized Alignment for Unsupervised Domain Adaptation,84,2018,NeurIPS,02 Mar 2022
af2101d604621ef87fc6c34cbd2adb5284161b59,Deep Statistical Solvers,1,2020,NeurIPS,02 Mar 2022
af27f9ada598a86435b778f136bec07d1294a69e,Incorporating BERT into Parallel Sequence Decoding with Adapters,18,2020,NeurIPS,02 Mar 2022
af2beb2a4ed7dda3e77348ae206b325578978bbb,A Statistical Recurrent Model on the Manifold of Symmetric Positive Definite Matrices,15,2018,NeurIPS,02 Mar 2022
af2f98aa2b19e550badaf6d043673285b27cbde8,On the Convergence and Robustness of Training GANs with Regularized Optimal Transport,84,2018,NeurIPS,02 Mar 2022
af5447b2908681ee9cff2b3c66ea2c1be8a13882,Information Constraints on Auto Encoding Variational Bayes,59,2018,NeurIPS,01 Mar 2022
af5bf0222a800b3da930db760f4c85751eb87435,Joint Contrastive Learning with Infinite Possibilities,18,2020,NeurIPS,02 Mar 2022
af634925fbc311ca7d0e0393feb6e18f36601b8f,Rethinking the Variational Interpretation of Accelerated Optimization Methods,0,2021,NeurIPS,02 Mar 2022
af641dd9da9f9a50423474a811e5ecdff40f5dd0,Improving Regret Bounds for Combinatorial Semi Bandits with Probabilistically Triggered Arms and Its Applications,51,2017,NeurIPS,02 Mar 2022
af678555cf75a8d991207223064dc5f2e1d7b6a1,Demystifying Black box Models with Symbolic Metamodels,33,2019,NeurIPS,02 Mar 2022
af679d69fcc1d0fcf0f039aba937853bcb50a8de,Luna Linear Unified Nested Attention,12,2021,NeurIPS,02 Mar 2022
af7307c05027fb6c5e907cdcb29af0b149db7056,Neural Execution Engines Learning to Execute Subroutines,13,2020,NeurIPS,02 Mar 2022
af76d2b86eb9fc9cd32ebbcd442e8c2178e0555f,Uncertainty on Asynchronous Time Event Prediction,13,2019,NeurIPS,02 Mar 2022
af79867811cf374fdb62bdf361741a00ca9f7ed3,Training Over parameterized Models with Non decomposable Objectives,0,2021,NeurIPS,02 Mar 2022
af7dc5b7fd87b8d820d7396043a23cf3fcb08be6,Improving Contrastive Learning on Imbalanced Seed Data via Open World Sampling,0,2021,NeurIPS,02 Mar 2022
af8376f8114ce2de4440a33445b43b6579df28c5,Smoothed Geometry for Robust Attribution,13,2020,NeurIPS,02 Mar 2022
af84c6db6b5c41ca628867ff4a27566e9ca3c69e,Beltrami Flow and Neural Diffusion on Graphs,3,2021,NeurIPS,02 Mar 2022
af9d0a18123c3bd8d8d2b1c44b03fdea5e9c3ae3,Learning Student Friendly Teacher Networks for Knowledge Distillation,4,2021,NeurIPS,02 Mar 2022
afa4ef653370390d0af700c81f1ba60e32f66a99,A New Alternating Direction Method for Linear Programming,12,2017,NeurIPS,02 Mar 2022
afb968c4b78bf2a8f34a9956eb86cde51cd05d5b,Vector valued Gaussian Processes on Riemannian Manifolds via Gauge Independent Projected Kernels,0,2021,NeurIPS,01 Mar 2022
afc3e33e4d3102b0fefcd513a312660c1b25142a,Task Adaptive Neural Network Search with Meta Contrastive Learning,0,2021,NeurIPS,02 Mar 2022
afd110eace912c2b273e64851c6b4df2658622eb,Visualizing and Measuring the Geometry of BERT,193,2019,NeurIPS,02 Mar 2022
afd6933a2c6cef8d791ecdbf57cc100a788c6756,Three Operator Splitting with Subgradients Stochastic Gradients and Adaptive Learning Rates,0,2021,NeurIPS,02 Mar 2022
afdae704979a6be9c030860ce2fb2c39d2d94eaa,"Is Deeper Better only when Shallow is Good ",25,2019,NeurIPS,02 Mar 2022
afdc5577cc9ed24b8d9855065061c528e79829db,A Theoretical Analysis of Fine tuning with Linear Teachers,2,2021,NeurIPS,02 Mar 2022
aff46129c5cb27fe3c000e0699c71dbdb7dc26a5,Attend and Predict Understanding Gene Regulation by Selective Attention on Chromatin,42,2017,NeurIPS,02 Mar 2022
b00cea45c85e68002d34b608aecb4fddd18210aa,Learning Graph Representations with Embedding Propagation,116,2017,NeurIPS,02 Mar 2022
b014aefd0c9bec572c7b72bebdcbed8753c77123,Learning a Single Neuron with Bias Using Gradient Descent,2,2021,NeurIPS,
b01c348df9d8d1dd466e9f7e95a8ee4be1465448,Robustness of Graph Neural Networks at Scale,1,2021,NeurIPS,02 Mar 2022
b0349a32497cf2586d784b639999c38d6a167c9d,Searching for Low Bit Weights in Quantized Neural Networks,32,2020,NeurIPS,02 Mar 2022
b03c7ff961822183bab66b2e594415e585d3fd09,"Are Sixteen Heads Really Better than One ",342,2019,NeurIPS,02 Mar 2022
b054fc685c3fa56459d5e49e4b42547164f8e024,BAIL Best Action Imitation Learning for Batch Deep Reinforcement Learning,15,2020,NeurIPS,02 Mar 2022
b098398f76739da965a790169da752ff5a788c5f,ICAM Interpretable Classification via Disentangled Representations and Feature Attribution Mapping,11,2020,NeurIPS,02 Mar 2022
b0a4b1f67632f3abd6e27a397be2d004020859f2,Explaining Landscape Connectivity of Low cost Solutions for Multilayer Nets,45,2019,NeurIPS,02 Mar 2022
b0bcbadd2c46822e51be003f950e3ae5d1f94427,Efficient and Flexible Inference for Stochastic Systems,5,2017,NeurIPS,02 Mar 2022
b0c40766974df3eae8ff500379e66e5566cd16c9,An Efficient Asynchronous Method for Integrating Evolutionary and Gradient based Policy Search,4,2020,NeurIPS,02 Mar 2022
b0cbad2b6f0288492dac7fe4ee0e3e33748d7252,Hamiltonian Dynamics with Non Newtonian Momentum for Rapid Sampling,0,2021,NeurIPS,02 Mar 2022
b0d675ebfbaf4b94bc517192bc5a6ea5890f60e8,Error Correcting Output Codes Improve Probability Estimation and Adversarial Robustness of Deep Neural Networks,32,2019,NeurIPS,02 Mar 2022
b0d8165eecf2aa04a85e701d0c6bb4edd4b3811b,A Unified Game Theoretic Approach to Multiagent Reinforcement Learning,342,2017,NeurIPS,02 Mar 2022
b0ef57dd0f226079cac20a2c2eceb0d65b5f7859,IRM when it works and when it doesn t A test case of natural language inference,1,2021,NeurIPS,02 Mar 2022
b11165bd0c9c86c7f8c5186b437c51043f4160e8,Efficient Active Learning for Gaussian Process Classification by Error Reduction,0,2021,NeurIPS,02 Mar 2022
b1250bb76f81cb120d96336997b83e3fd9174a4a,Densely connected normalizing flows,7,2021,NeurIPS,02 Mar 2022
b12ccd118974839db290f15c989649b2b5188636,Layer Wise Coordination between Encoder and Decoder for Neural Machine Translation,88,2018,NeurIPS,02 Mar 2022
b13130497dbeb5032e4d26d7c6bedbf0d0c112a4,Invariant Representations without Adversarial Training,106,2018,NeurIPS,02 Mar 2022
b1338641c1a981be589580b67a6b7b9fc2905ccc,Adaptive Machine Unlearning,8,2021,NeurIPS,02 Mar 2022
b14345b5ea6d4162aae7fa133920ae34875064b8,Found Graph Data and Planted Vertex Covers,11,2018,NeurIPS,02 Mar 2022
b152784a40cc8fad55fb5501308fcaa2f491cd14,Learning the optimal Tikhonov regularizer for inverse problems,1,2021,NeurIPS,02 Mar 2022
b156ddf444b997cbbc3168ee96ff76a85f0a5d62,Robust Visual Reasoning via Language Guided Neural Module Networks,7,2021,NeurIPS,02 Mar 2022
b158b038fd34bc1cddd2711d6cd719a22b244b2e,PasteGAN A Semi Parametric Method to Generate Image from Scene Graph,38,2019,NeurIPS,02 Mar 2022
b164a7dd0d6124e3a86df8a8e7374f9be8364033,Iterative Amortized Policy Optimization,7,2021,NeurIPS,02 Mar 2022
b168b0e5635eee17b84cf0eed2c320a9d71645cb,Partial Hard Thresholding Towards A Principled Analysis of Support Recovery,9,2017,NeurIPS,02 Mar 2022
b16a1dbafe57859de816cd71eb58c2164c4533b7,On the Consistency of Quick Shift,7,2017,NeurIPS,02 Mar 2022
b16da1b0401cf9085d4adbbb9885425a343b32bf,Multiclass Boosting and the Cost of Weak Learning,0,2021,NeurIPS,02 Mar 2022
b17972314b313d8e7388756507cf7f524797dca6,Approximate Cross Validation for Structured Models,5,2020,NeurIPS,02 Mar 2022
b18c29983850668db963d8d4db1ab27e28042b00,Permute and Flip A new mechanism for differentially private selection,12,2020,NeurIPS,02 Mar 2022
b1966a2a788f9152d7e94c20abf8bcf537662f9b,Hedging in games Faster convergence of external and swap regrets,10,2020,NeurIPS,02 Mar 2022
b19b4872ba1f358f79b9dec927b2f0e1cf8752aa,Heavy Tails in SGD and Compressibility of Overparametrized Neural Networks,2,2021,NeurIPS,02 Mar 2022
b1c7a73a70bdbd6b9fce1c711fd13290811a618c,Efficient Online Linear Optimization with Approximation Algorithms,16,2017,NeurIPS,02 Mar 2022
b1d4ac33305f5fbb7ea782047302fc778df790af,Process constrained batch Bayesian optimisation,11,2017,NeurIPS,02 Mar 2022
b1d67fc92db00421840af6f157e2d9e67a7154db,LinkNet Relational Embedding for Scene Graph,77,2018,NeurIPS,02 Mar 2022
b1df2dfda502516fa0346e0dff57851d223fffd9,Phase Retrieval Under a Generative Prior,101,2018,NeurIPS,02 Mar 2022
b1e3a356e1e71e3db72490d9dd771e3856d34f7c,On sensitivity of meta learning to support data,1,2021,NeurIPS,02 Mar 2022
b1e3ba851a77f6734e80ac7afdc548f90a2c6239,Learning Treatment Effects in Panels with General Intervention Patterns,2,2021,NeurIPS,02 Mar 2022
b1e93b7303d42da9aad9c78c70a2d487e8841a39,Parameter elimination in particle Gibbs sampling,5,2019,NeurIPS,02 Mar 2022
b1f7d2b398e49133918c23ef1776c57a4a85eae6,Variational Multi Task Learning with Gumbel Softmax Priors,2,2021,NeurIPS,02 Mar 2022
b1f8b985f706df559953aaeaca6c037f757e1e89,Revisiting Perceptron Efficient and Label Optimal Learning of Halfspaces,35,2017,NeurIPS,02 Mar 2022
b2059ee08fc11952fded5bf2b16dcf11801e02f4,Photonic Differential Privacy with Direct Feedback Alignment,0,2021,NeurIPS,01 Mar 2022
b2138a60c3c305e3577412ba147cf1a172d04a52,Learning with Differentiable Pertubed Optimizers,5,2020,NeurIPS,02 Mar 2022
b21a896715017a614ac12e16ce1e4559faaebcb1,Differentiable Cloth Simulation for Inverse Problems,57,2019,NeurIPS,02 Mar 2022
b22c5eff98c104404614363d191ddaf0dac5ae98,Hybrid Macro Micro Level Backpropagation for Training Deep Spiking Neural Networks,87,2018,NeurIPS,02 Mar 2022
b232f170e653641bf768727fd96c2aca3a03772b,Topological Detection of Trojaned Neural Networks,2,2021,NeurIPS,02 Mar 2022
b23d463fa147fe7322171c9c233cfbb8cba80fec,Explicit loss asymptotics in the gradient descent training of neural networks,1,2021,NeurIPS,02 Mar 2022
b243a9575dc97d1dfa956bd635407ff8f29eb024,Cost efficient gradient boosting,22,2017,NeurIPS,02 Mar 2022
b2472bf4962749b85184dfa64596a8f3fa84c747,Unsupervised Cross Modal Alignment of Speech and Text Embedding Spaces,63,2018,NeurIPS,02 Mar 2022
b24827f42e3ec6ff6af7a45b0e3e3334a7705d58,Adversarial Style Mining for One Shot Unsupervised Domain Adaptation,33,2020,NeurIPS,02 Mar 2022
b24f22ff89bfd7b2637250ce6238e43046471a9a,Learning in Multi Stage Decentralized Matching Markets,0,2021,NeurIPS,02 Mar 2022
b25a30451518d372817967a72e125d638c85379e,On the Fairness of Disentangled Representations,109,2019,NeurIPS,02 Mar 2022
b25b37a218af22b80467a993447732524e3f59db,Zero Shot Reinforcement Learning with Deep Attention Convolutional Neural Networks,4,2021,NeurIPS,02 Mar 2022
b25b40f1ea432be9bd5c225b67bb8e2917c37d82,Concentration of Multilinear Functions of the Ising Model with Applications to Network Data,20,2017,NeurIPS,02 Mar 2022
b260201571932718383eeb2d19a1957654513f98,Preference Based Batch and Sequential Teaching Towards a Unified View of Models,18,2019,NeurIPS,02 Mar 2022
b2612c955fcc2fcfa19786a55892f7d790387998,Asymptotics for Sketching in Least Squares Regression,29,2019,NeurIPS,02 Mar 2022
b2839d402c718e8778d7486d01c7608160d42e13,Proximal SCOPE for Distributed Sparse Learning,5,2018,NeurIPS,02 Mar 2022
b285b90ab4d6d1d726efc726b92f4075363004e6,SCOP Scientific Control for Reliable Neural Network Pruning,36,2020,NeurIPS,02 Mar 2022
b288c5ff809b34eb52ac0bddb6f7b1e11033edf3,Scalars are universal Equivariant machine learning structured like classical physics,9,2021,NeurIPS,02 Mar 2022
b2bf3ffa5844fde999dfe9ade000116566b319d9,Parallel Streaming Wasserstein Barycenters,67,2017,NeurIPS,02 Mar 2022
b2c078e7416de65bbc431c24762edcf33ac9f59b,Time Reversal Symmetric ODE Network,5,2020,NeurIPS,02 Mar 2022
b2c1df93e1b91b26450b87108cd105856625aa2c,Identifying Causal Effect Inference Failure with Uncertainty Aware Models,23,2020,NeurIPS,02 Mar 2022
b2c523ddc3cfe099a0a4dbc2d5671733b98b7a9b,Selective Sampling for Online Best arm Identification,1,2021,NeurIPS,02 Mar 2022
b2e706a8d1dbf1b7dec410d11fae3a524a038c0b,Online Convex Optimization Over Erdos Renyi Random Networks,1,2020,NeurIPS,02 Mar 2022
b2e73ffbfe54f7c8b13bb0a9415e6f67e70b14c5,Trustworthy Multimodal Regression with Mixture of Normal inverse Gamma Distributions,0,2021,NeurIPS,02 Mar 2022
b2eed66b5af3c80e41cb9123bc53b07e3dd92ff8,Solving Interpretable Kernel Dimensionality Reduction,7,2019,NeurIPS,02 Mar 2022
b305ad1ad57984bced2e5fb4b041361a2d5529e9,Efficient Clustering for Stretched Mixtures Landscape and Optimality,10,2020,NeurIPS,02 Mar 2022
b30a5a4839d6833114b226d0858b98d7a2efc59b,Amortized Variational Inference for Simple Hierarchical Models,0,2021,NeurIPS,02 Mar 2022
b30d3f54a7df2c5fce1c0876a547b8b8fb9869fc,Scalable Bayesian GPFA with automatic relevance determination and discrete noise models,5,2021,NeurIPS,02 Mar 2022
b327ab0cfeaef0a1df27ede3cf95a1e1f9cbba26,Learning Neural Representations of Human Cognition across Many fMRI Studies,23,2017,NeurIPS,02 Mar 2022
b32b2a265b5bc71ed55895add53dd80b2a82dab9,Scalable Inference in SDEs by Direct Matching of the Fokker Planck Kolmogorov Equation,0,2021,NeurIPS,02 Mar 2022
b3307af5964fb1b37e87c62b59b428fc23d0b411,Learning from Positive and Unlabeled Data with Arbitrary Positive Shift,5,2020,NeurIPS,02 Mar 2022
b33b735352c78743707f66e525f7cca65ff207b0,Latent World Models For Intrinsically Motivated Exploration,4,2020,NeurIPS,02 Mar 2022
b34e3a792b89fcf29d51c172f892df3ad41ee45b,Completing State Representations using Spectral Learning,0,2018,NeurIPS,02 Mar 2022
b3543d342a6ea754cca123012c477aca2234a872,SADGA Structure Aware Dual Graph Aggregation Network for Text to SQL,0,2021,NeurIPS,02 Mar 2022
b35b0a19425129432eefc21c3a9a1825f328c4b1,Compositional Generalization via Neural Symbolic Stack Machines,30,2020,NeurIPS,02 Mar 2022
b36def603507151622fcefd3d1bb40187a865d43,AutoGEL An Automated Graph Neural Network with Explicit Link Information,2,2021,NeurIPS,02 Mar 2022
b37a3f6e3c6e0bdfde6c5531bdf90d16df3f8d5c,Domain Adaptation with Conditional Distribution Matching and Generalized Label Shift,60,2020,NeurIPS,02 Mar 2022
b37ddbab1cbbd2f6cad233479907ca9d36c7967f,High contrast gaudy images improve the training of deep neural network models of visual cortex,0,2020,NeurIPS,02 Mar 2022
b37f99c3c5ce692e00b66e22235f0b851522fe04,Poincar Recurrence Cycles and Spurious Equilibria in Gradient Descent Ascent for Non Convex Non Concave Zero Sum Games,24,2019,NeurIPS,02 Mar 2022
b38491eee785b6312e386b2fb2090805e4d7ff0f,Towards Theoretically Understanding Why SGD Generalizes Better Than ADAM in Deep Learning,48,2020,NeurIPS,02 Mar 2022
b3afe7bc3eea84506605d31cdebee7884c7bf336,Periodic Activation Functions Induce Stationarity,0,2021,NeurIPS,02 Mar 2022
b3b88cb29938a5445edd543b0498a51c4931f840,DVERGE Diversifying Vulnerabilities for Enhanced Robust Generation of Ensembles,26,2020,NeurIPS,02 Mar 2022
b3c4d64059803ca239eaaed49ae683eb759f3d25,Scalable Spike Source Localization in Extracellular Recordings using Amortized Variational Inference,5,2019,NeurIPS,02 Mar 2022
b3cd477e7b4316a35d4943ab09da3aaab101e315,Clustering Billions of Reads for DNA Data Storage,29,2017,NeurIPS,02 Mar 2022
b3da8b723d912ffc372f2b7a03fbfbd6d3727c87,Manifold Topology Divergence a Framework for Comparing Data Manifolds,3,2021,NeurIPS,02 Mar 2022
b3e1fbbe2d577552c7a3bb9c980aeb2d1a3bbd2a,Variational Learning on Aggregate Outputs with Gaussian Processes,29,2018,NeurIPS,02 Mar 2022
b3eebeced34146949128b50249c7ac07d6829c71,Graph Structured Prediction Energy Networks,8,2019,NeurIPS,02 Mar 2022
b3f1aa12dde233aaf543bb9ccb27213c494e0fd5,Unlabeled Data Improves Adversarial Robustness,323,2019,NeurIPS,02 Mar 2022
b3f3debad9efdc5d49c2c9fda080efd3ef6970f3,Gradient Ascent for Best Response Regression,0,2017,NeurIPS,02 Mar 2022
b3fe9590ff72fb30d3763d9748554d53e146f6ac,A Study on Encodings for Neural Architecture Search,23,2020,NeurIPS,02 Mar 2022
b401aca53c04cec865e1a733090a2c60ca7ebe97,Glyce Glyph vectors for Chinese Character Representations,74,2019,NeurIPS,02 Mar 2022
b405764900fd2ec3979b16633056e0e6434973a8,Ridge Rider Finding Diverse Solutions by Following Eigenvectors of the Hessian,7,2020,NeurIPS,02 Mar 2022
b40d68b0b249b53fab4155ebae467c74af42311f,UCSG Net Unsupervised Discovering of Constructive Solid Geometry Tree,21,2020,NeurIPS,02 Mar 2022
b416471a6832556af6170b079331719d993fa66f,Region specific Diffeomorphic Metric Mapping,17,2019,NeurIPS,02 Mar 2022
b41dce2aa3f526437695a61026d389ba3a15cfd2,Differentiable Simulation of Soft Multi body Systems,2,2021,NeurIPS,02 Mar 2022
b41e07349b87a178d904e6b5d05a2f90b16f8e1e,Bias Out of the Box An Empirical Analysis of Intersectional Occupational Biases in Popular Generative Language Models,1,2021,NeurIPS,02 Mar 2022
b41e631c08be054ab19a88e3fb07077e03a6c53e,A Self Validation Network for Object Level Human Attention Estimation,5,2019,NeurIPS,02 Mar 2022
b41f91b685178997a2efebde4c395773b4dac7ab,Simple strategies for recovering inner products from coarsely quantized random projections,5,2017,NeurIPS,02 Mar 2022
b43557b4ea5eb6084022207e954a355f4963ae31,Distilling Object Detectors with Feature Richness,0,2021,NeurIPS,02 Mar 2022
b43962c129f6aaacc60a8e5224702df0699a364b,Modelling and unsupervised learning of symmetric deformable object categories,8,2018,NeurIPS,02 Mar 2022
b44a2c83260ff1a4fb3517305de756b865e6d03b,High Dimensional Linear Regression using Lattice Basis Reduction,9,2018,NeurIPS,02 Mar 2022
b44a5fee4170b1abeb988312e109bd25857d5589,Accelerated Stochastic Matrix Inversion General Theory and Speeding up BFGS Rules for Faster Second Order Optimization,33,2018,NeurIPS,02 Mar 2022
b451e37f41f4a98213010624d8e7c9a684368760,Distributed Multitask Reinforcement Learning with Quadratic Convergence,5,2018,NeurIPS,02 Mar 2022
b45a4b9bb65c64cf9eb1adcc08aa2e71cdf54718,A Linearly Convergent Method for Non Smooth Non Convex Optimization on the Grassmannian with Applications to Robust Subspace and Dictionary Learning,14,2019,NeurIPS,02 Mar 2022
b45ee0f67f5f6c9eaf5646f1a0c705819a7e656e,Grasp Proposal Networks An End to End Solution for Visual Learning of Robotic Grasps,8,2020,NeurIPS,02 Mar 2022
b47175d0015e328eb209512a52a0a1314894468a,Efficient Algorithms for Non convex Isotonic Regression through Submodular Optimization,10,2018,NeurIPS,02 Mar 2022
b47264a0b34b940e1cc16390553a75144d3caab5,Biological learning in key value memory networks,1,2021,NeurIPS,02 Mar 2022
b472c74ae787d77a5f163d89326800f7a46f295f,Optimal Adaptive Electrode Selection to Maximize Simultaneously Recorded Neuron Yield,3,2020,NeurIPS,02 Mar 2022
b47c4fb8aacfbd6060e9846efade77231e33c22d,Federated Reconstruction Partially Local Federated Learning,7,2021,NeurIPS,02 Mar 2022
b47e4c6de3050d5582187208186eda7d32a27005,How SGD Selects the Global Minima in Over parameterized Learning A Dynamical Stability Perspective,73,2018,NeurIPS,02 Mar 2022
b4895de425a02af87713bd78ed1a29fe425753af,Decoupling the Depth and Scope of Graph Neural Networks,2,2021,NeurIPS,02 Mar 2022
b493510901862493031528b4e5e6e2be1699e7ef,Learning efficient task dependent representations with synaptic plasticity,4,2020,NeurIPS,02 Mar 2022
b498986c348c4789a2d86953b8455ba630d2ead0,Asymptotic normality and confidence intervals for derivatives of 2 layers neural network in the random features model,1,2020,NeurIPS,02 Mar 2022
b499228aa74b59be32711c3926e44de208d6b636,Image Captioning Transforming Objects into Words,117,2019,NeurIPS,02 Mar 2022
b49f0998b4f8e356a8e3f4313917585cb6a33f57,Generalization Bounds For Meta Learning An Information Theoretic Analysis,1,2021,NeurIPS,02 Mar 2022
b4a632a7097e7d0631250884dfc6e1f76b376996,PowerSGD Practical Low Rank Gradient Compression for Distributed Optimization,104,2019,NeurIPS,02 Mar 2022
b4abc7a988caa0a965098335e3f6c6d25ac265dd,Proximal Mapping for Deep Regularization,0,2020,NeurIPS,02 Mar 2022
b4b7aa1471b07e2d662755c8dad944abee1d9aa0,Selective Adversarial Adaptation Learning via Exclusive Regularization for Partial Domain Adaptation,0,2021,NeurIPS,02 Mar 2022
b4bbecd26e90e05543f826616b367d1ecad8f906,Multiplicative Weights Update with Constant Step Size in Congestion Games Convergence Limit Cycles and Chaos,88,2017,NeurIPS,02 Mar 2022
b4c1cd3f391c34bab08d6094c91793cb59f2da81,Adversarial Risk and Robustness General Definitions and Implications for the Uniform Distribution,47,2018,NeurIPS,02 Mar 2022
b4c497e5aede128c9f30520a730390c0a5de33a6,Characterizing the Exact Behaviors of Temporal Difference Learning Algorithms Using Markov Jump Linear System Theory,38,2019,NeurIPS,02 Mar 2022
b4c7e68dc5ed9d40777458b381e4dfa733e83ef8,Attention Bottlenecks for Multimodal Fusion,16,2021,NeurIPS,02 Mar 2022
b4d207a2096aee4a3764933373eef6edb574c952,Accelerated Sparse Neural Training A Provable and Efficient Method to Find N M Transposable Masks,9,2021,NeurIPS,02 Mar 2022
b4d2d6788a38b77d1096a4ae1dbf35f794e0df5a,Learning from Label Proportions with Generative Adversarial Networks,7,2019,NeurIPS,02 Mar 2022
b4e644ef70f1df3c80d246730efa29069f70fd36,Environment Generation for Zero Shot Compositional Reinforcement Learning,3,2021,NeurIPS,02 Mar 2022
b5080e6eb7bc58417d0a9272a30119ca7a185218,Gradient based Adaptive Markov Chain Monte Carlo,9,2019,NeurIPS,02 Mar 2022
b51cdc040f98831b47e0848ee1f382e2e4d3ff57,ResNets Ensemble via the Feynman Kac Formalism to Improve Natural and Robust Accuracies,34,2019,NeurIPS,02 Mar 2022
b524d278dd11eecd2bbd156d3c014cd8575c4036,Variational Laws of Visual Attention for Dynamic Scenes,22,2017,NeurIPS,02 Mar 2022
b54b2f314d73d92da6c1bc137e4bbc3536da5240,Implicit Bias in Deep Linear Classification Initialization Scale vs Training Accuracy,33,2020,NeurIPS,02 Mar 2022
b558a40450cb5d82c42e03ab463f2e4614ef8fc7,Algorithmic Stability and Generalization of an Unsupervised Feature Selection Algorithm,0,2021,NeurIPS,02 Mar 2022
b56fcbc32adcbe19caec31aaaf0fe045db5ad2b3,Learning Loop Invariants for Program Verification,59,2018,NeurIPS,02 Mar 2022
b5777f90e48070ec508419f3f7afd59255d409b0,Reducing the variance in online optimization by transporting past gradients,16,2019,NeurIPS,02 Mar 2022
b578455a06224fbcaf5b1d22efcaee787e487e4e,Faster Boosting with Smaller Memory,5,2019,NeurIPS,02 Mar 2022
b586094d51c17d37807a17d06e3cb8e40269eb16,Designing Counterfactual Generators using Deep Model Inversion,0,2021,NeurIPS,02 Mar 2022
b58a9d674201af9de74c1d65580f4d742c60d52a,Automorphic Equivalence aware Graph Neural Network,0,2021,NeurIPS,02 Mar 2022
b58d8579ece27a60432e667bfbdb750590fa65d9,True Few Shot Learning with Language Models,41,2021,NeurIPS,02 Mar 2022
b58f6674bf54fdee0ce1bc36d536e3b1d50030ad,No Press Diplomacy from Scratch,2,2021,NeurIPS,02 Mar 2022
b593cc253f0bb64bb21d703d29b0b08109931ba6,Probabilistic Watershed Sampling all spanning forests for seeded segmentation and semi supervised learning,2,2019,NeurIPS,02 Mar 2022
b59f0d9d7ff800ebf495a66b91fd351be8ccd9d0,Visualizing the Emergence of Intermediate Visual Patterns in DNNs,2,2021,NeurIPS,02 Mar 2022
b5a3e761d0f2c2aeac7804d7ff87887711988e30,Attention in Convolutional LSTM for Gesture Recognition,48,2018,NeurIPS,02 Mar 2022
b5ad1fb5b098c2223f5ff7ed2a147e88698b828f,Off Policy Interval Estimation with Lipschitz Value Iteration,2,2020,NeurIPS,02 Mar 2022
b5bb16e1de8bce93ab78bf578090d1d64ebd25c2,Dynamic Bottleneck for Robust Self Supervised Exploration,2,2021,NeurIPS,02 Mar 2022
b5d07040427336dc0acde7c53cc34b16d1a18449,Implicit Regularization in Matrix Sensing via Mirror Descent,0,2021,NeurIPS,02 Mar 2022
b5d3e8776739a1b1a3853f00c97739c4bae7d52d,Walsh Hadamard Variational Inference for Bayesian Deep Learning,7,2020,NeurIPS,02 Mar 2022
b602efa185003c999c29aca3b9b1da43e0e78c14,Beyond Smoothness Incorporating Low Rank Analysis into Nonparametric Density Estimation,0,2021,NeurIPS,02 Mar 2022
b611636f3cfe7b9aa41a606bec1d9fa72e1359ae,ATOMO Communication efficient Learning via Atomic Sparsification,185,2018,NeurIPS,02 Mar 2022
b61e2ee2ce7b928299f9a9dbd8c2ecebdcfe43ff,HOUDINI Lifelong Learning as Program Synthesis,40,2018,NeurIPS,02 Mar 2022
b621486dd67033711f998cde35430128c43d4a51,Optimization for Approximate Submodularity,12,2018,NeurIPS,02 Mar 2022
b639d2c614219f3de1e6a21091a1ad8d443916e8,Simplifying Hamiltonian and Lagrangian Neural Networks via Explicit Constraints,31,2020,NeurIPS,02 Mar 2022
b64f19eec18ca872b5fb82c733f824bac3441570,Estimation of the covariance structure of heavy tailed distributions,27,2017,NeurIPS,02 Mar 2022
b652fc6bac4d3ec0583212788be488c2e0a79012,A Geometric Perspective on Optimal Representations for Reinforcement Learning,44,2019,NeurIPS,02 Mar 2022
b655629cf5d61d129c1c5619001d47469f5e264f,High Dimensional Contextual Policy Search with Unknown Context Rewards using Bayesian Optimization,5,2020,NeurIPS,02 Mar 2022
b667641dc6acd7c0233503615942ea00ea9875f5,Continual Learning of Control Primitives Skill Discovery via Reset Games,9,2020,NeurIPS,02 Mar 2022
b66a4d3b0657bf38e5fe760fb45154b13a73fc2e,Credal Self Supervised Learning,0,2021,NeurIPS,02 Mar 2022
b66d2a7a76faac55892da47750dcd88bf7e94d51,Differentially Private Model Personalization,2,2021,NeurIPS,02 Mar 2022
b670d587c3a8c25ad04b5c9e4c5456cc6b830d07,On Fast Leverage Score Sampling and Optimal Learning,46,2018,NeurIPS,02 Mar 2022
b672afc19364cc801b54543f4f87408ac2c41078,Logarithmic Pruning is All You Need,28,2020,NeurIPS,02 Mar 2022
b68bc1f79ab7484818692624a52449d3d033fcb2,Regularizing Black box Models for Improved Interpretability,24,2020,NeurIPS,02 Mar 2022
b68c994dd32621baea6c47494e5266e1259c4f0e,Node Dependent Local Smoothing for Scalable Graph Learning,0,2021,NeurIPS,02 Mar 2022
