paperID,title,citations,year,conference,last_updated
3a7d613897dac0a93fa0baa374928271858904f0,Batch Normalization Biases Residual Blocks Towards the Identity Function in Deep Networks,36,2020,NeurIPS,02 Mar 2022
3a9074ed5c1ba5feed3655005ee513a2f1e6eea1,A unified framework for bandit multiple testing,2,2021,NeurIPS,02 Mar 2022
3a9e19783bbc71bf2b89d2441fc78cc47c3f5a69,Unsupervised Noise Adaptive Speech Enhancement by Discriminator Constrained Optimal Transport,0,2021,NeurIPS,02 Mar 2022
3aaaca5f8b217fd9d980af57288c2c2a900e9899,Analysis of Krylov Subspace Solutions of Regularized Non Convex Quadratic Problems,30,2018,NeurIPS,02 Mar 2022
3aada1c85cb5648687ab5ff45c14a8ca99b4ed8e,Online Optimization with Memory and Competitive Control,16,2020,NeurIPS,02 Mar 2022
3aadab924520c58be81781aafd51e6807e9c4576,Visual Reinforcement Learning with Imagined Goals,288,2018,NeurIPS,02 Mar 2022
3ac35486b33b8c055e9956f4ff8cee23340c0f7a,The Scaling Limit of High Dimensional Online Independent Component Analysis,9,2017,NeurIPS,02 Mar 2022
3ad67266f468fdc3101ffa09c207bb0ebcaadd10,Transductive Zero Shot Learning with Visual Structure Constraint,38,2019,NeurIPS,02 Mar 2022
3aeef8fa7e5a947e0798a9ff3bcbb0e7c857c5ec,Learning High Precision Bounding Box for Rotated Object Detection via Kullback Leibler Divergence,10,2021,NeurIPS,02 Mar 2022
3aefd5ad5927ccb4178026ac2e0391f3939457cd,Learning Diverse and Discriminative Representations via the Principle of Maximal Coding Rate Reduction,27,2020,NeurIPS,02 Mar 2022
3af6e08f7939167a598042b5f22f7c99e9b07f7f,Neural Distance Embeddings for Biological Sequences,0,2021,NeurIPS,02 Mar 2022
3af74a34a9a0719a9b5e0b294e4d07002460a239,Self Adaptively Learning to Demoire from Focused and Defocused Image Pairs,1,2020,NeurIPS,02 Mar 2022
3afeac7346708bd4bb137f4471de22ff48ac838d,Implicit Sparse Regularization The Impact of Depth and Early Stopping,2,2021,NeurIPS,02 Mar 2022
3b02eb62f198449840334da26917e3610b283e25,Controlled Text Generation as Continuous Optimization with Multiple Constraints,3,2021,NeurIPS,02 Mar 2022
3b06c6b02595427fd35a4d98bf9b963380bbb920,Generalization of Model Agnostic Meta Learning Algorithms Recurring and Unseen Tasks,8,2021,NeurIPS,02 Mar 2022
3b073e6609d89e62301622b4db3508da59cd6847,Multi task Learning of Order Consistent Causal Graphs,0,2021,NeurIPS,02 Mar 2022
3b0fb765716ef6861a84abffcbe40643857c613b,Pruning neural networks without any data by iteratively conserving synaptic flow,122,2020,NeurIPS,02 Mar 2022
3b107ef43220114c9d4c3a21ded4e3b4c2fd80ed,Robust Counterfactual Explanations on Graph Neural Networks,4,2021,NeurIPS,02 Mar 2022
3b1941105317edaef6ac5995089d6d916e5fb483,Differential Privacy Has Disparate Impact on Model Accuracy,134,2019,NeurIPS,02 Mar 2022
3b196f40ba895c82c78c5e9b81f6733a6bf127c5,A PAC Bayesian Analysis of Randomized Learning with Application to Stochastic Gradient Descent,52,2017,NeurIPS,02 Mar 2022
3b1fd5a4d659eb36c4f5166e75e907b9decacced,Exact marginal prior distributions of finite Bayesian neural networks,5,2021,NeurIPS,02 Mar 2022
3b2c6b2184f28e0aeebeb8a1ca884979e2b53415,On Provable Benefits of Depth in Training Graph Convolutional Networks,2,2021,NeurIPS,02 Mar 2022
3b2f5884e8199544375ddcdb4fa58f44df0b1a7e,Be Confident Towards Trustworthy Graph Neural Networks via Confidence Calibration,2,2021,NeurIPS,02 Mar 2022
3b3088de26d5d94e3d38957f74e3833f8bd9b1c0,Partitioning Structure Learning for Segmented Linear Regression Trees,0,2019,NeurIPS,02 Mar 2022
3b316377f1d7cbcf3c907c4d8b08c05f4521b541,On the Importance of Gradients for Detecting Distributional Shifts in the Wild,8,2021,NeurIPS,02 Mar 2022
3b3d7adb9047d01af6dfa2975ad8addd69715e96,Mastering Atari Games with Limited Data,2,2021,NeurIPS,02 Mar 2022
3b40e40dc4ba143e3170f515d052d1e0885ecc04,Fast rates for prediction with limited expert advice,0,2021,NeurIPS,02 Mar 2022
3b5bd23386ded50640d285bc95d748272b23ca5c,Training Stronger Baselines for Learning to Optimize,8,2020,NeurIPS,02 Mar 2022
3b65e86418476e7b1c90b47b48fd278f1e474834,Finding Optimal Tangent Points for Reducing Distortions of Hard label Attacks,0,2021,NeurIPS,01 Mar 2022
3b6ccd6203219915b8eee88596ea8f5526ebf772,Meta Learning of Structured Representation by Proximal Mapping,0,2021,NeurIPS,02 Mar 2022
3b6e0d1ce667a2a7971edb83dd6598b8e68725fb,Non Convex SGD Learns Halfspaces with Adversarial Label Noise,11,2020,NeurIPS,02 Mar 2022
3b75e0d7550c8322d279cf97c9c4d947a2762a72,The effect of folding wingtips on the worst case gust loads of a simplified aircraft model,4,2021,NeurIPS,02 Mar 2022
3b885531e9fe143d66de43ee3ddfae90d3f50c56,DeepGEM Generalized Expectation Maximization for Blind Inversion,0,2021,NeurIPS,02 Mar 2022
3b8ea78d3df177ccd4985a85441e393b344f3fa6,Covariate Powered Empirical Bayes Estimation,8,2019,NeurIPS,02 Mar 2022
3b8ec47d263d243a9aacf3c38149d12a13ec4b1d,Asymptotic Guarantees for Learning Generative Models with the Sliced Wasserstein Distance,27,2019,NeurIPS,02 Mar 2022
3b98c0ab98068813052200766b76d6eb0b381a87,Adaptive Clustering through Semidefinite Programming,23,2017,NeurIPS,02 Mar 2022
3b9b96dbcea2f4a683096ac217606788a30814bd,Accelerated First order Methods for Geodesically Convex Optimization on Riemannian Manifolds,52,2017,NeurIPS,02 Mar 2022
3ba013b8b56646d66aac8472fb90a5c029ef55a0,Learning Differential Equations that are Easy to Solve,37,2020,NeurIPS,02 Mar 2022
3ba22d51516dfb24e26015c681d660e2f227bb96,The Utility of Explainable AI in Ad Hoc Human Machine Teaming,2,2021,NeurIPS,02 Mar 2022
3bab355a4660edcc3f6e10df5e260dcf92f630d0,Distribution Aligning Refinery of Pseudo label for Imbalanced Semi supervised Learning,18,2020,NeurIPS,02 Mar 2022
3bb0fbe66c51fcf48aa02a5175c3d11bd41b3ee8,Stochastic Primal Dual Method for Empirical Risk Minimization with O 1 Per Iteration Complexity,25,2018,NeurIPS,02 Mar 2022
3bd6e4f596d99a47e1e70504e0fc51267ab213e9,Triple Generative Adversarial Nets,294,2017,NeurIPS,02 Mar 2022
3bd9c5d3527349af57c05b6f1288ffbc0bfdd93f,Improved Network Robustness with Adversary Critic,11,2018,NeurIPS,02 Mar 2022
3beb091c80739f2ed605728f408a67e454c99b79,Geometric Dataset Distances via Optimal Transport,22,2020,NeurIPS,01 Mar 2022
3c03be6129ad998af6961899c6c486de23073a76,Implicit Distributional Reinforcement Learning,5,2020,NeurIPS,02 Mar 2022
3c093c5abb1559b155babebfe76b35f44c3c09cf,Learning to Correlate in Multi Player General Sum Sequential Games,18,2019,NeurIPS,02 Mar 2022
3c12d8a5cc76ee4349774a1671d8d8d82e430ce2,Task Agnostic Undesirable Feature Deactivation Using Out of Distribution Data,1,2021,NeurIPS,02 Mar 2022
3c1d30ffa5c445bf7a9190084b030dc24dbdf78f,Learning to Predict Layout to image Conditional Convolutions for Semantic Image Synthesis,78,2019,NeurIPS,02 Mar 2022
3c23156d111e70fe7a1397db896906b93959127e,De randomizing MCMC dynamics with the diffusion Stein operator,0,2021,NeurIPS,02 Mar 2022
3c3093f5f8e9601637612fcfb8f160f116fa30e4,Diversity Driven Exploration Strategy for Deep Reinforcement Learning,38,2018,NeurIPS,02 Mar 2022
3c37bd592c0cb595a0291af53d2b82d848d2afd5,Learning Disentangled Behavior Embeddings,1,2021,NeurIPS,02 Mar 2022
3c3bbb8ed683414652248ed98f67d44c02d40543,New Insight into Hybrid Stochastic Gradient Descent Beyond With Replacement Sampling and Convexity,15,2018,NeurIPS,02 Mar 2022
3c4372b125d0744bb68bfca9f5d6b0abb85dd182,Characterizing possible failure modes in physics informed neural networks,12,2021,NeurIPS,02 Mar 2022
3c46fa25b0215678c62524a7a9a883bdc8a0c041,Multipole Graph Neural Operator for Parametric Partial Differential Equations,52,2020,NeurIPS,02 Mar 2022
3c477ab15e988d96f06f747c650f426231e07577,Unbiased estimates for linear regression via volume sampling,38,2017,NeurIPS,02 Mar 2022
3c4867ccf37b5b8902ec719695eb42575e1afe75,Scalable Thompson Sampling using Sparse Gaussian Process Models,7,2021,NeurIPS,02 Mar 2022
3c4c4da15148523533ee1c227c7b55feb9720379,Estimating Rank One Spikes from Heavy Tailed Noise via Self Avoiding Walks,3,2020,NeurIPS,02 Mar 2022
3c574538e1d37cc5f7428aeda5e106c932a48e12,"Do Different Tracking Tasks Require Different Appearance Models ",4,2021,NeurIPS,02 Mar 2022
3c57a1aa483d8bffe1339914b80d2913f2dc8376,Good Semi supervised Learning That Requires a Bad GAN,330,2017,NeurIPS,02 Mar 2022
3c61e6b55597cf37b19d2e4b38fc66b9c85c97b9,Ultra Low Precision 4 bit Training of Deep Neural Networks,29,2020,NeurIPS,02 Mar 2022
3c63f8b8263cd6cc4c8c7429d46bb656accddc49,Hybrid Reward Architecture for Reinforcement Learning,161,2017,NeurIPS,02 Mar 2022
3c77d04336c637e69d865cd7eb91cbec0664a4ee,Dealing With Misspecification In Fixed Confidence Linear Top m Identification,1,2021,NeurIPS,02 Mar 2022
3c787ee8a2fa0c21325219e068c9246e11fe3249,Contrastive Learning for Neural Topic Model,1,2021,NeurIPS,02 Mar 2022
3c7dea39fbfa59f566f134bbb0b0f68464561910,PIDForest Anomaly Detection via Partial Identification,7,2019,NeurIPS,02 Mar 2022
3c8695b0d59ca059580701c3673228acf44a9a75,Recurrent Bayesian Classifier Chains for Exact Multi Label Classification,0,2021,NeurIPS,02 Mar 2022
3c8a456509e6c0805354bd40a35e3f2dbf8069b1,PyTorch An Imperative Style High Performance Deep Learning Library,10758,2019,NeurIPS,02 Mar 2022
3c8edad04afae9420f3fd0056b5bf8c28e9a5e02,Ultrahyperbolic Representation Learning,7,2020,NeurIPS,02 Mar 2022
3cabd7e9b4f919a951d802b2c46c1def508cb2d4,Coupling based Invertible Neural Networks Are Universal Diffeomorphism Approximators,28,2020,NeurIPS,02 Mar 2022
3caf26a81f8b8be27b8ebc09bdb93416b4c40fe6,Improving Generalization in Reinforcement Learning with Mixture Regularization,16,2020,NeurIPS,02 Mar 2022
3cb13b61804d5ff0d96c7cca127087171c880beb,Exponential Bellman Equation and Improved Regret Bounds for Risk Sensitive Reinforcement Learning,1,2021,NeurIPS,02 Mar 2022
3cb22cb8ba3faeaccad6bf5c00ed66d3ab09ba7e,Primal Dual Interpretation of the Proximal Stochastic Gradient Langevin Algorithm,6,2020,NeurIPS,02 Mar 2022
3cb8106a75825891cafdb9ee76246af7c8013cd9,Network to Network Regularization Enforcing Occam s Razor to Improve Generalization,0,2021,NeurIPS,02 Mar 2022
3cb992574d08894da40752ec8db6e5dd86cdd6e3,A KL LUCB algorithm for Large Scale Crowdsourcing,10,2017,NeurIPS,02 Mar 2022
3cdb40d2cfa2d52ad0ce9626933d4fb04b5c4cbc,Unsupervised Video Object Segmentation for Deep Reinforcement Learning,47,2018,NeurIPS,02 Mar 2022
3cdfb3129e8231bb52b09c97921253451ec0ec1d,Model Based Episodic Memory Induces Dynamic Hybrid Controls,1,2021,NeurIPS,02 Mar 2022
3ce247c6bbbb47dcecaab9649423f4b8a8b717c3,Manifold GPLVMs for discovering non Euclidean latent structure in neural data,9,2020,NeurIPS,02 Mar 2022
3ce6db16e460ca7c27913bb06b0295ecbfee1530,Model Similarity Mitigates Test Set Overuse,21,2019,NeurIPS,02 Mar 2022
3ce6f49009b583415290054d53b28810c0584b84,Active 3D Shape Reconstruction from Vision and Touch,3,2021,NeurIPS,02 Mar 2022
3ce9c183cb046ee3e25d1694c8dd95d354c16a45,Discovering Reinforcement Learning Algorithms,35,2020,NeurIPS,02 Mar 2022
3cfbed14169d69c568ec0114ae1e5464ca5af736,Adaptive Shrinkage Estimation for Streaming Graphs,2,2020,NeurIPS,02 Mar 2022
3d0443409f77818a4570c895cfdbe6b20d691743,Decentralized Langevin Dynamics for Bayesian Learning,4,2020,NeurIPS,02 Mar 2022
3d0dae1090a915ec937fc42cb348c7a7279fdb44,Efficient Deep Approximation of GMMs,1,2019,NeurIPS,02 Mar 2022
3d1adad6fd30aab50ea9c3ea682b8a279c5f30c8,An Infinite Feature Extension for Bayesian ReLU Nets That Fixes Their Asymptotic Overconfidence,2,2021,NeurIPS,02 Mar 2022
3d21012ad3696351537cec2149ce81262dba52f2,Linear Stochastic Bandits Under Safety Constraints,36,2019,NeurIPS,02 Mar 2022
3d22bbc6cd373d8a3e4688fa0a4ec24590ecff05,CoMIR Contrastive Multimodal Image Representation for Registration,13,2020,NeurIPS,02 Mar 2022
3d2861d4fa3816afb672014eaee03978b965a1e0,Asynchronous Stochastic Optimization Robust to Arbitrary Delays,1,2021,NeurIPS,02 Mar 2022
3d2e9e1c193e2fd0b0e059cabd17bc65dbfcf733,Dynamics Regulated Kinematic Policy for Egocentric Pose Estimation,1,2021,NeurIPS,02 Mar 2022
3d38bd8d205d6f97e5d1e68c343b88b8ca5ee2b3,Improving Inference for Neural Image Compression,22,2020,NeurIPS,02 Mar 2022
3d3eb44e9887ccf42ce39edf4c68ade11d732a25,Geometrically Coupled Monte Carlo Sampling,26,2018,NeurIPS,02 Mar 2022
3d3ff489af804adc0eda902c31405b28c99cd654,Scalable Multi Agent Reinforcement Learning for Networked Systems with Average Reward,15,2020,NeurIPS,02 Mar 2022
3d4744525f91dff6d2e37e487aa4bf8c2beedb93,Self Supervised Generative Adversarial Compression,3,2020,NeurIPS,02 Mar 2022
3d4b1c580c4df032549a84ee1a5114a09863ce18,SOLQ Segmenting Objects by Learning Queries,7,2021,NeurIPS,02 Mar 2022
3d4c12e7fe41e8d42de3059eda5accee97140505,Fine Grained Neural Network Explanation by Identifying Input Features with Predictive Information,0,2021,NeurIPS,02 Mar 2022
3d4c4cd680da0ebd2d774c5b5236b9db3da15185,Self training Avoids Using Spurious Features Under Domain Shift,22,2020,NeurIPS,02 Mar 2022
3d5087e3d50f9806d6de301d0ec7d0e35a1d482d,Convergence of adaptive algorithms for constrained weakly convex optimization,0,2021,NeurIPS,02 Mar 2022
3d52df5c7151de8b4e318effb31db89daabaa7cd,Gradient EM Bayesian Meta learning,8,2020,NeurIPS,02 Mar 2022
3d536d7cc77665b4df5a37036ef914811a284189,An Optimal Elimination Algorithm for Learning a Best Arm,2,2020,NeurIPS,02 Mar 2022
3d597e16ef56119bb6e6d78e3f379623862f0752,On gradient regularizers for MMD GANs,72,2018,NeurIPS,02 Mar 2022
3d856d797356ab32be936e74a7eed39766bfc0d3,Fast Accurate and Simple Models for Tabular Data via Augmented Distillation,15,2020,NeurIPS,02 Mar 2022
3d89830c0dd84bcd42b202c402aba1e0286015e7,Robust Reinforcement Learning via Adversarial training with Langevin Dynamics,17,2020,NeurIPS,02 Mar 2022
3d8ee24a324870963add554e9b3c4d4d5ffe8334,Mixture Matrix Completion,6,2018,NeurIPS,02 Mar 2022
3d951a374fcb009607d42fa178bce9254a65a48b,Information theoretic Task Selection for Meta Reinforcement Learning,4,2020,NeurIPS,02 Mar 2022
3d9f4ec1b875613cf9473a4807a0dd96c2012e0d,Best of Both Worlds Practical and Theoretically Optimal Submodular Maximization in Parallel,0,2021,NeurIPS,02 Mar 2022
3da257b0d284bfe2c709d4e7ab3c2252bf7d8cea,Dual Instrumental Variable Regression,23,2020,NeurIPS,02 Mar 2022
3dae6b4f9f68e1c8256256a69496b8c4ab04a37a,Noise2Score Tweedie s Approach to Self Supervised Image Denoising without Clean Images,3,2021,NeurIPS,02 Mar 2022
3db121a9f4307bf160e81fc50f879095e9473497,Efficient learning of discrete graphical models,21,2020,NeurIPS,02 Mar 2022
3dcb83f0fca4c4cd7da507310d2bd9b10cff6b09,Stein Self Repulsive Dynamics Benefits From Past Samples,5,2020,NeurIPS,02 Mar 2022
3dd37ab4c574f011646de6691f9166db22e3591f,Adversarial Regularizers in Inverse Problems,110,2018,NeurIPS,02 Mar 2022
3dd80563756363f45b42d997b9d4111a74ebbdf8,MagNet A Neural Network for Directed Graphs,5,2021,NeurIPS,02 Mar 2022
3dd82533dc93f132ee0fe03767083d0154ad2afb," Almost Free Incentivized Exploration from Decentralized Learning Agents",1,2021,NeurIPS,02 Mar 2022
3dd8bf5cca76b1690a2642b73b509fb3a27e4f36,MetaReg Towards Domain Generalization using Meta Regularization,247,2018,NeurIPS,02 Mar 2022
3dd9fcecf193b0d09394b8a6f1907b1365f830b6,Alternating optimization of decision trees with application to learning sparse oblique trees,34,2018,NeurIPS,02 Mar 2022
3de341622b1d66306e4d217310deb333159573c1,Structure Learning with Side Information Sample Complexity,2,2019,NeurIPS,02 Mar 2022
3debd5396291148d0d3a39f90ce97b959eacefb7,Uncertainty Aware Learning for Zero Shot Semantic Segmentation,17,2020,NeurIPS,02 Mar 2022
3dee26d84538cd5861e3b66c030b671094c2d91d,CHIP CHannel Independence based Pruning for Compact Neural Networks,0,2021,NeurIPS,02 Mar 2022
3e15f730e6603955df7b926971bf0ce64025b616,Generalizing GANs A Turing Perspective,13,2017,NeurIPS,02 Mar 2022
3e19a257825066f9a6db913f8d546524c0dc3387,Learning Plannable Representations with Causal InfoGAN,113,2018,NeurIPS,02 Mar 2022
3e1b060ebacfc7a966ec735c940e2ee48f2a7a99,Firefly Neural Architecture Descent a General Approach for Growing Neural Networks,9,2020,NeurIPS,02 Mar 2022
3e1d263859d0b525d47c70ddf903dbd0ad200059,On the Stochastic Stability of Deep Markov Models,2,2021,NeurIPS,02 Mar 2022
3e2081ca2282ed3fd6a213a2403238e148cf3998,Continuous Latent Process Flows,0,2021,NeurIPS,02 Mar 2022
3e2413603b930c084cf16f161a1a3db637fb5fd6,Walking in the Shadow A New Perspective on Descent Directions for Constrained Minimization,4,2020,NeurIPS,02 Mar 2022
3e2517ae3a37e55d4f16817d8f2b09c29b5b7b1b,Evidential Sparsification of Multimodal Latent Spaces in Conditional Variational Autoencoders,8,2020,NeurIPS,02 Mar 2022
3e2e6707c90b75186a2020f73a04d4e4c706347f,Cross Scale Internal Graph Neural Network for Image Super Resolution,23,2020,NeurIPS,02 Mar 2022
3e3f2083af962e4c5ea4d2ed414e51d7c3b801be,Synthetic Data Generators Sequential and Private,1,2020,NeurIPS,02 Mar 2022
3e5b2e90fd35b49190b2ab762c9a2a7b4fbf5b65,Large scale optimal transport map estimation using projection pursuit,14,2019,NeurIPS,02 Mar 2022
3e70bbe6c4cd98d66599db709e32b748f184a2d4,CondConv Conditionally Parameterized Convolutions for Efficient Inference,133,2019,NeurIPS,02 Mar 2022
3e74eb8f87370a7b30b510e90edab25ae80c206d,Robustness Analysis of Non Convex Stochastic Gradient Descent using Biased Expectations,7,2020,NeurIPS,02 Mar 2022
3e7f5f4382ac6f9c4fef6197dd21abf74456acd1,Big Self Supervised Models are Strong Semi Supervised Learners,581,2020,NeurIPS,02 Mar 2022
3e85ff3a0bba0eaecd0c3d6c19a4385f0eccfe9e,Distilling Image Classifiers in Object Detectors,0,2021,NeurIPS,
3e866bcaa04cddd0d31b28a9f76ff6a3bfb7c2f0,GIFT Learning Transformation Invariant Dense Visual Descriptors via Group CNNs,23,2019,NeurIPS,02 Mar 2022
3e88e156577c542855c5bc2ff935c4b84947a1f4,Probabilistic Models for Integration Error in the Assessment of Functional Cardiac Models,17,2017,NeurIPS,02 Mar 2022
3e8923eadd533eb1098f7bc89ae47547bcac1f1d,Symplectic Adjoint Method for Exact Gradient of Neural ODE with Minimal Memory,3,2021,NeurIPS,02 Mar 2022
3e9590c203973597d17df9b567a360be171a61d8,Near Optimal Lower Bounds For Convex Optimization For All Orders of Smoothness,1,2021,NeurIPS,02 Mar 2022
3e9590c6dc8ec459a23b038da2d46205036d0f26,Sparse Logistic Regression Learns All Discrete Pairwise Graphical Models,36,2019,NeurIPS,02 Mar 2022
3e9da3c6f52a8c6fa16f08c49e20c4eb0165dd06,Nonconvex Sparse Graph Learning under Laplacian Constrained Graphical Model,5,2020,NeurIPS,02 Mar 2022
3eb3a91f7005ce655c6986383a7ed74d4327dbf2,Dynamic Causal Bayesian Optimization,1,2021,NeurIPS,02 Mar 2022
3eb44cc190093ba35e5cb6c54d107cd9220d58f5,Compositional generalization through meta sequence to sequence learning,100,2019,NeurIPS,02 Mar 2022
3ec64420c0c65156938ccab5aeb56f910fcd602b,Direct Runge Kutta Discretization Achieves Acceleration,77,2018,NeurIPS,02 Mar 2022
3ecc35641a8d104210f70d932a37c30040cc9eff,Credit Assignment For Collective Multiagent RL With Global Rewards,40,2018,NeurIPS,02 Mar 2022
3ecfdf2f7d2130fa7260b6cb75eb1f2c1c07b990,Learning Deterministic Weighted Automata with Queries and Counterexamples,22,2019,NeurIPS,02 Mar 2022
3ed81ee5a442944be51fc2dadc708ec1e2cef07c,Consistent Robust Regression,66,2017,NeurIPS,02 Mar 2022
3ed8c08c9322f4e86d49fd18003ae80229c3b433,KS GNN Keywords Search over Incomplete Graphs via Graphs Neural Network,1,2021,NeurIPS,02 Mar 2022
3ee49e33b7e7b7a3a8c3af354cfb735ab08af31d,Boundary thickness and robustness in learning models,9,2020,NeurIPS,02 Mar 2022
3eebdbffbc05d6b2987010c4d594cfc11b9b5071,On Reward Free Reinforcement Learning with Linear Function Approximation,41,2020,NeurIPS,02 Mar 2022
3eebe1ba5996e2fb4f8daa157956d2d071fc2473,Unbiased Classification Through Bias Contrastive and Bias Balanced Learning,1,2021,NeurIPS,02 Mar 2022
3ef152e877cb27c363ff8a3a2426cde13ad5f1f5,Unbalanced Sobolev Descent,1,2020,NeurIPS,02 Mar 2022
3ef211a46b6f24930b148b12d69a8dbab0390047,Delayed Propagation Transformer A Universal Computation Engine towards Practical Control in Cyber Physical Systems,0,2021,NeurIPS,02 Mar 2022
3ef24a64a27260147dfcac8d12b2650d1d194179,Efficient Exact Verification of Binarized Neural Networks,12,2020,NeurIPS,02 Mar 2022
3ef3c555d735cabcfd823a1343569401fb312461,SGD with shuffling optimal rates without component convexity and large epoch requirements,13,2020,NeurIPS,02 Mar 2022
3ef82a1db7d79dc91548fb4c9f70e08812def751,SoftFlow Probabilistic Framework for Normalizing Flow on Manifolds,16,2020,NeurIPS,02 Mar 2022
3efff8528bcd7f9f0883d78d6db4762e0142cbfb,Deanonymization in the Bitcoin P2P Network,42,2017,NeurIPS,02 Mar 2022
3f060ab22e694d3df2bb272e877de75437fdd954,Generalization Bounds for Wasserstein Robust Optimization,0,2021,NeurIPS,02 Mar 2022
3f0f6c19c6f5d4e4d5066984c5f3e922a2c2ff85,ELLA Exploration through Learned Language Abstraction,2,2021,NeurIPS,02 Mar 2022
3f15336e532e249ab5e516a67abaa8bc545f275b,Small ReLU networks are powerful memorizers a tight analysis of memorization capacity,54,2019,NeurIPS,02 Mar 2022
3f1ab8b484f7881a68c8562ff908390742e4ba90,Can Decentralized Algorithms Outperform Centralized Algorithms A Case Study for Decentralized Parallel Stochastic Gradient Descent,521,2017,NeurIPS,02 Mar 2022
3f2119c1717754cf74a7413d05c38a5f80a66e7a,Distinguishing Distributions When Samples Are Strategically Transformed,8,2019,NeurIPS,02 Mar 2022
3f245c3d85d109216135aaddc059528bb2ce2b05,On the Accuracy of Influence Functions for Measuring Group Effects,71,2019,NeurIPS,01 Mar 2022
3f2e8394c134491ece39f4514658421b10ba5421,Learning Hard Optimization Problems A Data Generation Perspective,1,2021,NeurIPS,02 Mar 2022
3f4615ce7118151e243cad5544f0c75b01be171e,Metric Learning for Adversarial Robustness,79,2019,NeurIPS,02 Mar 2022
3f4b852b45ac44e0b7fa79b778b05f5d231306b7,Sample Efficient Stochastic Gradient Iterative Hard Thresholding Method for Stochastic Sparse Linear Regression with Limited Attribute Observation,5,2018,NeurIPS,02 Mar 2022
3f618d2500477729926ce7d9d311e7e69477dc07,Bridging the Imitation Gap by Adaptive Insubordination,6,2021,NeurIPS,02 Mar 2022
3f6570fd55dc5855f93a56150e6d99c7944a1c1e,The Hateful Memes Challenge Detecting Hate Speech in Multimodal Memes,107,2020,NeurIPS,02 Mar 2022
3f7bc67330b3eff749459568e7995f0017dfe645,Robustness to Adversarial Perturbations in Learning from Incomplete Data,75,2019,NeurIPS,02 Mar 2022
3f84ca0965f572d4d2944dc0952076e0785b72b1,Extracting Relationships by Multi Domain Matching,40,2018,NeurIPS,02 Mar 2022
3f8e2cdd7a73ea0193f43ee3b69a717baded5310,MobILE Model Based Imitation Learning From Observation Alone,2,2021,NeurIPS,02 Mar 2022
3f9474022c113b087cb0ccb65ddea05672e22745,How Can I Explain This to You An Empirical Study of Deep Neural Network Explanation Methods,28,2020,NeurIPS,02 Mar 2022
3f963a700f3d89aebefde51a7e895a145964af53,LIIR Learning Individual Intrinsic Reward in Multi Agent Reinforcement Learning,51,2019,NeurIPS,02 Mar 2022
3fa5d98c33087af2c8481486ebbdb1a3ec3ba3cd,Noether s Learning Dynamics Role of Symmetry Breaking in Neural Networks,0,2021,NeurIPS,02 Mar 2022
3fad63c17de83a8634c8d8d91b49fcb63c95e777,Dynamical mean field theory for stochastic gradient descent in Gaussian mixture classification,11,2020,NeurIPS,02 Mar 2022
3fb57ec446d612a1586e2d950032eab4adc25452,Crowdsourcing via Pairwise Co occurrences Identifiability and Algorithms,15,2019,NeurIPS,02 Mar 2022
3fb634fa8d95db8121143e10700d2368a08f31e4,Exploiting Chain Rule and Bayes Theorem to Compare Probability Distributions,1,2021,NeurIPS,02 Mar 2022
3fb97331135ff8716a25d1bbe17b9ac1b7c2392a,Separation Results between Fixed Kernel and Feature Learning Probability Metrics,1,2021,NeurIPS,02 Mar 2022
3fccd53067a85e809ca16c5b2b6aee3bd38017df,Differentiable Meta Learning of Bandit Policies,8,2020,NeurIPS,02 Mar 2022
3fd96fe6f1ea5193536296f291aff00439eb9bbd,The Physical Systems Behind Optimization Algorithms,14,2018,NeurIPS,02 Mar 2022
3fdea116c8a13e1fda4d084b94e334ebe381e5e9,Tree Sliced Variants of Wasserstein Distances,32,2019,NeurIPS,02 Mar 2022
3fe019f5ee31a4be3fe24b687f555006e17d27c5,SLAYER Spike Layer Error Reassignment in Time,249,2018,NeurIPS,02 Mar 2022
3fe41ee4ec74a6aa6b4fcf21dbeff38a7a1fc59c,End to end Multi modal Video Temporal Grounding,1,2021,NeurIPS,02 Mar 2022
3ff6943d72dde3bc6383dd0ebcc1238f4de890ce,Taming Discrete Integration via the Boon of Dimensionality,4,2020,NeurIPS,02 Mar 2022
3ffcc28278b797850dde686a88bda2f4c8def214,Linear Disentangled Representations and Unsupervised Action Estimation,4,2020,NeurIPS,02 Mar 2022
401dfc5efbd182eaef6945249aea8a0a1e3cced5,Shaping Belief States with Generative Environment Models for RL,64,2019,NeurIPS,02 Mar 2022
4027fe2fcb6026601487c298fe2fc45d3df5e7df,Posterior Re calibration for Imbalanced Datasets,7,2020,NeurIPS,02 Mar 2022
402b27b96cb63360aab2a4ec572f13e30f92ee88,Graph Geometry Interaction Learning,20,2020,NeurIPS,02 Mar 2022
402e57ca89f0e21451d8c79abecf185d1f20b2b0,CANITA Faster Rates for Distributed Convex Optimization with Communication Compression,5,2021,NeurIPS,02 Mar 2022
4039c32b213be716b6164162fa95d7eb078670e2,A Combinatorial Perspective on Transfer Learning,3,2020,NeurIPS,02 Mar 2022
405f2de412eff9e04ba2ae74fe21fdb692c9da60,Linear Convergence in Federated Learning Tackling Client Heterogeneity and Sparse Gradients,3,2021,NeurIPS,02 Mar 2022
406ee84afaf116f52b169494c1d0ede2da4f9f05,An Empirical Study on The Properties of Random Bases for Kernel Methods,13,2017,NeurIPS,02 Mar 2022
4070d111b843f022d6d4d48435e4e87e355ca18c,Adaptive stimulus selection for optimizing neural population responses,10,2017,NeurIPS,02 Mar 2022
4071081c34975ab577fa0f2c08ff4f4d7dc79f08,Sinkhorn Barycenters with Free Support via Frank Wolfe Algorithm,43,2019,NeurIPS,02 Mar 2022
407f3c4ffda9e0ad4ecdb1830f062aaea88e5912,Monotone operator equilibrium networks,25,2020,NeurIPS,02 Mar 2022
40922d386116975853a743b1d810c1e0f03e886a,Understanding and Improving Layer Normalization,52,2019,NeurIPS,02 Mar 2022
