paperID,title,citations,year,conference,last_updated
000798184970fba0ec374416f2e4338f2f2a9f63,Representation Learning for Integrating Multi domain Outcomes to Optimize Individualized Treatments,1,2020,NeurIPS,02 Mar 2022
000a7562f8786a4a8721e9aca92615a33ac1a51b,Statistical control for spatio temporal MEG EEG source imaging with desparsified multi task Lasso,4,2020,NeurIPS,02 Mar 2022
00102d213c04a751ecb95e8a78662b040a0ee9bb,A Mathematical Framework for Quantifying Transferability in Multi source Transfer Learning,1,2021,NeurIPS,02 Mar 2022
0011cd8b3d28049949d8aec06ec85d5ab7802b42,Exploiting the Intrinsic Neighborhood Structure for Source free Domain Adaptation,1,2021,NeurIPS,02 Mar 2022
0011d0b1962473d54ac720f78f6c49103b01b77b,GILBO One Metric to Measure Them All,12,2018,NeurIPS,02 Mar 2022
0014a3f86460286deb5e536da5e278eefcedf5df,The Autoencoding Variational Autoencoder,4,2020,NeurIPS,02 Mar 2022
00215f32433e4e69ddb5a678b3f02568334d67ca,Classification with Valid and Adaptive Coverage,38,2020,NeurIPS,02 Mar 2022
0024665d8ea4843317a2af5629ff1e096ec3212c,Model evidence from nonequilibrium simulations,4,2017,NeurIPS,02 Mar 2022
002e7ffbee5539486fb607ac11301819959e47a5,High Dimensional Multivariate Forecasting with Low Rank Gaussian Copula Processes,52,2019,NeurIPS,02 Mar 2022
003376467ba21a6321bbe31d99173a4fd5e21f34,Deep Neural Networks with Box Convolutions,9,2018,NeurIPS,02 Mar 2022
0048b8b6fb7986f67cdd9e9c0b5012c9b6d7c9e7,Bayesian Deep Ensembles via the Neural Tangent Kernel,30,2020,NeurIPS,02 Mar 2022
004ddf5a39a735d0f8ec7547629c2bee65eb1f93,On Testing for Biases in Peer Review,35,2019,NeurIPS,02 Mar 2022
00549af4bc3270e0f688acbf694f912d7ee39cad,Devign Effective Vulnerability Identification by Learning Comprehensive Program Semantics via Graph Neural Networks,93,2019,NeurIPS,02 Mar 2022
0056f01a8281ed5551ab473f39772541c23e5421,Nearly Horizon Free Offline Reinforcement Learning,9,2021,NeurIPS,
007112213ece771be72cbecfd59f048209facabd,A simple neural network module for relational reasoning,1129,2017,NeurIPS,02 Mar 2022
0071f09e43c50372730bc9e9a89fee32c12c2d63,Metric on Nonlinear Dynamical Systems with Perron Frobenius Operators,18,2018,NeurIPS,02 Mar 2022
007d08aee3b88489fe0377849f70688de66adae8,Bandit Learning with Implicit Feedback,14,2018,NeurIPS,02 Mar 2022
007fd689a806de99f053a0f5ef90aedb44f9ec7e,Better Exploration with Optimistic Actor Critic,45,2019,NeurIPS,02 Mar 2022
008ba3c574f8e5085dfb1eef0342e8b408565e45,Labelling unlabelled videos from scratch with multi modal self supervision,41,2020,NeurIPS,02 Mar 2022
008cfd24dfdfb28fc6a89c32772c7ffe5cb0cf8a,Towards mental time travel a hierarchical memory for reinforcement learning agents,4,2021,NeurIPS,02 Mar 2022
009c42dac6316c0f72b14e353b654560906a0e0f,What shapes feature representations Exploring datasets architectures and training,37,2020,NeurIPS,02 Mar 2022
00a86528f269fb173d7e28166f10865e0d5bff37,Improving the Expected Improvement Algorithm,55,2017,NeurIPS,02 Mar 2022
00b8d70f022c74d374cfe16177d67c791eb9a0f3,Weston Watkins Hinge Loss and Ordered Partitions,2,2020,NeurIPS,02 Mar 2022
00c3bfcc503e675e640cb92d71611f0e43bf43dc,"When do neural networks outperform kernel methods ",62,2020,NeurIPS,02 Mar 2022
00d1d3e5335a8d08ea3e4cf629b54b7c1f47ca80,Dimension Free Bounds for Low Precision Training,5,2019,NeurIPS,02 Mar 2022
00d6c4aa261fb3fb4e8e76997bce91f9336f250f,Using Options and Covariance Testing for Long Horizon Off Policy Policy Evaluation,35,2017,NeurIPS,02 Mar 2022
00ed0301cb889393bec5f2f32172bf8fc872ca1b,Adversarially robust change point detection,0,2021,NeurIPS,02 Mar 2022
0106ac3ed6867af22d732cf7640b766cc98d256b,Deliberation Networks Sequence Generation Beyond One Pass Decoding,144,2017,NeurIPS,02 Mar 2022
0109c19abf9f63d54f97029b186d5acf32faf10f,Multiplicative Weights Updates with Constant Step Size in Graphical Constant Sum Games,8,2018,NeurIPS,02 Mar 2022
0117a728bd065bae714198f97163803baf6c29f0,SalKG Learning From Knowledge Graph Explanations for Commonsense Reasoning,1,2021,NeurIPS,02 Mar 2022
012058e709106bef41356aab850fef0841bdd01e,Detecting Interactions from Neural Networks via Topological Analysis,1,2020,NeurIPS,02 Mar 2022
0121253bb8f536dfd364a19de869d58039cfb55c,Implicit Transformer Network for Screen Content Image Continuous Super Resolution,0,2021,NeurIPS,02 Mar 2022
013ef3de1cc144b3014216255e8161b6e013d7ee,Grounding Spatio Temporal Language with Transformers,1,2021,NeurIPS,02 Mar 2022
0147893b1aac35b7dad24d5342638292b39b362e,Demystifying Orthogonal Monte Carlo and Beyond,4,2020,NeurIPS,02 Mar 2022
0160323cb1448679da2e61a78db5db0d9be1001d,Bayesian Alignments of Warped Multi Output Gaussian Processes,19,2018,NeurIPS,02 Mar 2022
0162df96157511cd06d30cd3554e6ccd36210734,Online Robust Regression via SGD on the l1 loss,10,2020,NeurIPS,02 Mar 2022
016a3ba7adcae71f5a23ed2663d8062ae1da63e6,SAC Accelerating and Structuring Self Attention via Sparse Adaptive Connection,7,2020,NeurIPS,02 Mar 2022
017b7d892a558bde3fa8e20b9cc7e0d2050a28aa,A Unified Approach to Fair Online Learning via Blackwell Approachability,2,2021,NeurIPS,02 Mar 2022
0187141e52f6d5cd0cf812ced648960e8f610abe,Learning Perceptual Inference by Contrasting,49,2019,NeurIPS,02 Mar 2022
018af49afa0f61647b71cccfdf6f2ece092e4356,Interactive Structure Learning with Structural Query by Committee,9,2018,NeurIPS,02 Mar 2022
019185c2989d265eb9e85b312c65136558f13e63,Functional Variational Inference based on Stochastic Process Generators,0,2021,NeurIPS,02 Mar 2022
0192e32c1c158917eb92cb21431a63c93b2893ee,Communication Compression for Decentralized Training,145,2018,NeurIPS,02 Mar 2022
0196da6be47525fe4869ca32332095b06ed0e3dc,Few Shot Segmentation via Cycle Consistent Transformer,3,2021,NeurIPS,02 Mar 2022
0197d510416b1bf8ea88561724b4c3487dd0e8c9,The Inductive Bias of Quantum Kernels,8,2021,NeurIPS,02 Mar 2022
019b4d058d3c6df0e35c53c313cb1622241f00c2,The Importance of Communities for Learning to Influence,13,2017,NeurIPS,02 Mar 2022
019e2c1ee5d87aab11cb6cf74cae75d5413db9cd,Regime Switching Bandits,8,2021,NeurIPS,02 Mar 2022
019fdf22d15541aeaee96e1b7bbaf87164df3a2d,Benchmarking deep inverse models over time and the neural adjoint method,11,2020,NeurIPS,02 Mar 2022
01a5a65451f5343bca8f3c75e583b7c4c89187dd,MMA Regularization Decorrelating Weights of Neural Networks by Maximizing the Minimal Angles,2,2020,NeurIPS,02 Mar 2022
01addabc8df1d6c51b76271a6aedfcd038e1b1db,Topographic VAEs learn Equivariant Capsules,4,2021,NeurIPS,02 Mar 2022
01ae8022893eb7ccc87f54ab81eb6693aa527c28,Active Exploration for Learning Symbolic Representations,10,2017,NeurIPS,01 Mar 2022
01b5412f3d17e90e09226d7c40ad4d4468a1414d,Multimodal Few Shot Learning with Frozen Language Models,23,2021,NeurIPS,02 Mar 2022
01b60237d6e6a2534e3d05bcd40bb00bf79ccd7d,An Efficient Transfer Learning Framework for Multiagent Reinforcement Learning,0,2021,NeurIPS,02 Mar 2022
01c9f0ff83eb1c17eadee89737b3febf6c47d086,Zero shot Learning via Simultaneous Generating and Learning,29,2019,NeurIPS,02 Mar 2022
01cf1d83b7a4983001a50ec274043f53783ee94e,Understanding Attention and Generalization in Graph Neural Networks,98,2019,NeurIPS,02 Mar 2022
01cf48fd15ce4a261c2cbcdc99624ddc683c96da,AttendLight Universal Attention Based Reinforcement Learning Model for Traffic Signal Control,3,2020,NeurIPS,02 Mar 2022
01db8a5e8d3d868517eb3b2b50aabcabf7b66d50,Hybrid Models for Learning to Branch,23,2020,NeurIPS,02 Mar 2022
01e2cc4ff7414ce9f407d0626a41b77fa6be60e3,On component interactions in two stage recommender systems,1,2021,NeurIPS,02 Mar 2022
01f0f10e7d121eef12b45df617af6273546af94f,Deep ReLU Networks Have Surprisingly Few Activation Patterns,87,2019,NeurIPS,02 Mar 2022
0201703c263041201dcc93326867f6f561a05c22,Nonstochastic Multiarmed Bandits with Unrestricted Delays,20,2019,NeurIPS,02 Mar 2022
020cf45c6780eb3789ebd7401943ddf5a10dfe76,Debiased Visual Question Answering from Feature and Sample Perspectives,1,2021,NeurIPS,02 Mar 2022
022123ba8890fa88813bc50c07250ee4ed632527,RL for Latent MDPs Regret Guarantees and a Lower Bound,10,2021,NeurIPS,02 Mar 2022
02281117aa6a4848ce9092d203aad85d14ee7e84,Towards a combinatorial characterization of bounded memory learning,2,2020,NeurIPS,02 Mar 2022
0236dab4e67276dd014a1dd3d4ead5b84b8ef9e1,Neumann networks differential programming for supervised learning with missing values,5,2020,NeurIPS,02 Mar 2022
0247a1058cbcbb7afbdbb58b95b820298ba76af9,Better Safe Than Sorry Preventing Delusive Adversaries with Adversarial Training,7,2021,NeurIPS,02 Mar 2022
0254e59206404096073f89f7fa49d95139c6ee84,Active Assessment of Prediction Services as Accuracy Surface Over Attribute Combinations,0,2021,NeurIPS,02 Mar 2022
0255d978f9aac4842eca219872cd5e07dee5bf35,On The Classification Distortion Perception Tradeoff,10,2019,NeurIPS,02 Mar 2022
027220cee4d728e4fbfe00a7558902ed8bea0243,Learning With Feature Evolvable Streams,21,2017,NeurIPS,02 Mar 2022
0278d047bbba31ddcd8813356e4ca2d1854de5a6,Fast deep reinforcement learning using online adjustments from the past,24,2018,NeurIPS,02 Mar 2022
02853eaf34209269d893e7200098b37962d345ea,Amortized Inference Regularization,50,2018,NeurIPS,02 Mar 2022
028917f52d25d9044848aafccc64432914e9e6d1,Object DGCNN 3D Object Detection using Dynamic Graphs,2,2021,NeurIPS,02 Mar 2022
028969f5b5135797ba0690b46aaa3042a7720f6a,Deep Molecular Representation Learning via Fusing Physical and Chemical Information,1,2021,NeurIPS,02 Mar 2022
0289d774bd0dc8025005110973d5b8e6439197d8,Temporal Spike Sequence Learning via Backpropagation for Deep Spiking Neural Networks,31,2020,NeurIPS,02 Mar 2022
028e68f5ec8acc1918f350693921b46a51a06807,Private Identity Testing for High Dimensional Distributions,24,2020,NeurIPS,01 Mar 2022
028fee34cdd53d6c3fcc14641bba69c36222e6a3,ContraGAN Contrastive Learning for Conditional Image Generation,39,2020,NeurIPS,02 Mar 2022
029490920cd736e91d6c57f3cfb850adddcf2725,Self Supervised Generation of Spatial Audio for 360 Video,75,2018,NeurIPS,02 Mar 2022
0295df1b9d11e6e49b20119410fd755a4d7781af,Behavior From the Void Unsupervised Active Pre Training,19,2021,NeurIPS,02 Mar 2022
0295fb87bc5d8eb63ff2e6ead911d8d8f152a13d,Visual Object Networks Image Generation with Disentangled 3D Representations,131,2018,NeurIPS,02 Mar 2022
02bbd21fa9c282fe990a5f4e8d3b7c0196b8253e,The Potts Ising model for discrete multivariate data,0,2020,NeurIPS,02 Mar 2022
02c12f5c657d3aa98bbcaf0ac4b321da239af3c1,Contrast and Mix Temporal Contrastive Video Domain Adaptation with Background Mixing,3,2021,NeurIPS,02 Mar 2022
02d367a1cf5d3a757834f2c45b29b4fdc7b7458c,Handling Missing Data with Graph Representation Learning,22,2020,NeurIPS,02 Mar 2022
02e666b3fa5ced3719d9581251966eef23c53339,Meta Learning Reliable Priors in the Function Space,3,2021,NeurIPS,02 Mar 2022
02e7edc4b45a8903f5c41aa0ab5606fb15dfae54,Context aware Synthesis and Placement of Object Instances,60,2018,NeurIPS,02 Mar 2022
02eda5db3fcac704e5c0292f5260c1154e4c5ee4,Towards Real Time Reinforcement Learning Control of a Wave Energy Converter,7,2019,NeurIPS,02 Mar 2022
02f09989359a0447591d9cc71c768c89b5dfd475,TopRank A practical algorithm for online stochastic ranking,39,2018,NeurIPS,02 Mar 2022
02f4641337a51d1d7794367a8efb3398f505b8cb,Local Hyper flow Diffusion,1,2021,NeurIPS,02 Mar 2022
02f5a1f0aa1a03758ba22170be6eb27fae9f6263,Bipartite Stochastic Block Models with Tiny Clusters,11,2018,NeurIPS,02 Mar 2022
02f920db21feed5f4d334358e5a49f22dbac65a0,Efficient Gradient Computation for Structured Output Learning with Rational and Tropical Losses,2,2018,NeurIPS,02 Mar 2022
02fb9014304ba37c6712231855c8863d79681fad,Bootstrap Your Object Detector via Mixed Training,0,2021,NeurIPS,02 Mar 2022
0305fc4e22aae739f4a7bdfc49e1d9317cae4447,Parallelizing Thompson Sampling,1,2021,NeurIPS,02 Mar 2022
0308de39c39cb0d501bbabf49e505cc192d234b5,Why so gloomy A Bayesian explanation of human pessimism bias in the multi armed bandit task,4,2018,NeurIPS,02 Mar 2022
03097420a1c4b2500cec6f29740f9d3c2164168f,Exact Combinatorial Optimization with Graph Convolutional Neural Networks,117,2019,NeurIPS,02 Mar 2022
0312159e2e1afddcc7961035ad7a2ea31aa5965c,A Critical Look at the Consistency of Causal Estimation With Deep Latent Variable Models,1,2021,NeurIPS,02 Mar 2022
0313dec02e7ea7b98f8353b42c3ca31923d3e15c,Knowledge Augmented Deep Neural Networks for Joint Facial Expression and Action Unit Recognition,12,2020,NeurIPS,02 Mar 2022
032d865e92d97613a3659ec4a0b3e3243535b8ff,Backpropagation Friendly Eigendecomposition,22,2019,NeurIPS,02 Mar 2022
032e6b00ff267148a52e7623d370c4b7cac11762,Evolutionary Stochastic Gradient Descent for Optimization of Deep Neural Networks,35,2018,NeurIPS,02 Mar 2022
033ca87372d74ee2d9d4bc283e64f8f7bb3bc512,COHESIV Contrastive Object and Hand Embeddings for Segmentation In Video,1,2021,NeurIPS,02 Mar 2022
033e207ac07462a43959cb0298d979c443c8a9a4,Provably adaptive reinforcement learning in metric spaces,3,2020,NeurIPS,02 Mar 2022
034881a501ed487e769e50d70fe5a8c5b6a01096,Revisiting Smoothed Online Learning,0,2021,NeurIPS,02 Mar 2022
034b2e3d957df5405783f2c5695a8c2bd87d6334,FLAMBE Structural Complexity and Representation Learning of Low Rank MDPs,49,2020,NeurIPS,02 Mar 2022
034b8b81b2162d2eb3340f1068beecfd3efdddf4,A theory on the absence of spurious solutions for nonconvex and nonsmooth optimization,34,2018,NeurIPS,02 Mar 2022
035cde75f41e7c37fd21bb2cd5bbb4a761b7bac9,Unified Sample Optimal Property Estimation in Near Linear Time,16,2019,NeurIPS,02 Mar 2022
03654665467d5cac1919eeb050f3faf4b3a770f6,Scheduling Jobs with Stochastic Holding Costs,0,2021,NeurIPS,02 Mar 2022
0366b6396610708a77540564050a90a761a28937,Reinforcement Learning for Solving the Vehicle Routing Problem,281,2018,NeurIPS,02 Mar 2022
03700ad9bea6cdb705fe51834f46cd037c78c13f,Distributional Robustness with IPMs and links to Regularization and GANs,10,2020,NeurIPS,02 Mar 2022
037f36390bc61b4cc03eb646a7c00ddddef01d61,GumBolt Extending Gumbel trick to Boltzmann priors,7,2018,NeurIPS,02 Mar 2022
03887d5a9829301f6e5cb2d47655db68430f4d16,One Shot Object Detection with Co Attention and Co Excitation,59,2019,NeurIPS,02 Mar 2022
0392a3e410842ee9ae6155722b81762753b6744a,A New Theory for Matrix Completion,26,2017,NeurIPS,02 Mar 2022
039b1c1210c437f3b3ce6e0275ee2137bf5b951c,Assessing Social and Intersectional Biases in Contextualized Word Representations,68,2019,NeurIPS,02 Mar 2022
03a0378368f43ca5ff7561f8a9937240eb6beeb2,On the Model Shrinkage Effect of Gamma Process Edge Partition Models,4,2017,NeurIPS,02 Mar 2022
03a50adbe75ea5bc02b9350c5b9f0e80084d93b0,Streaming Weak Submodularity Interpreting Neural Networks on the Fly,76,2017,NeurIPS,02 Mar 2022
03a73cf5dc1dc2f147f3f308810f4dbbfbf24534,Conditional Independence Testing using Generative Adversarial Networks,14,2019,NeurIPS,02 Mar 2022
03b34e25484f90ca85fd8429bccd963445b47feb,Steering Distortions to Preserve Classes and Neighbors in Supervised Dimensionality Reduction,0,2020,NeurIPS,02 Mar 2022
03b481e995c3d450dcd0411742a7fef49a1e531a,Contextual Bandits with Cross learning,17,2019,NeurIPS,02 Mar 2022
03ba8a5ba730cded0145a3a1576b789fe8af74c6,Learning Game Theoretic Models of Multiagent Trajectories Using Implicit Layers,5,2021,NeurIPS,
03c20f9696521b8a9bb2737bbfd2bb933454ff3d,Quality Aware Generative Adversarial Networks,13,2019,NeurIPS,02 Mar 2022
03c346060b2cbf04947305f0a5a36eef6ca852ec,System Identification with Biophysical Constraints A Circuit Model of the Inner Retina,2,2020,NeurIPS,02 Mar 2022
03c699252dfda256dc70cd5b818b0b76775f784e,Understanding the Generalization Benefit of Model Invariance from a Data Perspective,0,2021,NeurIPS,02 Mar 2022
03c7ee9ac5d7db4dd006600b28d6687b61a02890,Making the Cut A Bandit based Approach to Tiered Interviewing,6,2019,NeurIPS,02 Mar 2022
03d12f37e7794607d5eca1397c98a52cbf80abf3,Learning Mixtures of Plackett Luce Models from Structured Partial Orders,8,2019,NeurIPS,02 Mar 2022
03d364221049c84333862872e044f6f0153ee639,Extrapolation Towards Imaginary 0 Nearest Neighbour and Its Improved Convergence Rate,1,2020,NeurIPS,02 Mar 2022
03db529f0bfae6d0b64b0feef565196327fe8d50,Intriguing Properties of Vision Transformers,44,2021,NeurIPS,02 Mar 2022
03dc950fb0a6506db22c65de8a1340988c393642,Certainty Equivalence is Efficient for Linear Quadratic Control,79,2019,NeurIPS,02 Mar 2022
03e7eafeb3b3939ade1c900db5f16d1dc367f86a,Neural Machine Translation with Soft Prototype,8,2019,NeurIPS,02 Mar 2022
040be180b42c4911599be5299871be0268c5566a,The Implicit Metropolis Hastings Algorithm,4,2019,NeurIPS,02 Mar 2022
040ffa54aa9e138ea619487a7f347c550624b8d6,Importance Resampling for Off policy Prediction,19,2019,NeurIPS,02 Mar 2022
0417e7ca089195ccbf730109c637ef593ec94fa8,The Normalization Method for Alleviating Pathological Sharpness in Wide Neural Networks,17,2019,NeurIPS,02 Mar 2022
041f1a3921f37511937580ad6c0d4b5a5ba7960a,Learn Imagine and Create Text to Image Generation from Prior Knowledge,29,2019,NeurIPS,02 Mar 2022
0427901fc1a7d365f295bab773b6361b3c427b07,Online Structure Learning for Feed Forward and Recurrent Sum Product Networks,19,2018,NeurIPS,02 Mar 2022
042f197def36b7caa9be4f54fb05199e8db480f2,Learning Semantic Representations to Verify Hardware Designs,0,2021,NeurIPS,02 Mar 2022
043775f075d62c33a0817a6e866e39543dafd26e,Causal Discovery in Physical Systems from Videos,31,2020,NeurIPS,02 Mar 2022
0438b00b764ae01967ab421f0ce5eaf43b767f8b,Personalizing Many Decisions with High Dimensional Covariates,4,2019,NeurIPS,02 Mar 2022
043ac94f9dd3093802a7c870cf13d0f589ab640f,Learning with Optimized Random Features Exponential Speedup by Quantum Machine Learning without Sparsity and Low Rank Assumptions,4,2020,NeurIPS,02 Mar 2022
043f084e379a44608c470059c2aa174a323e9774,Counterfactual Fairness,689,2017,NeurIPS,02 Mar 2022
0445f093231855219475afa7216e2729ba0af2ec,On Large Cohort Training for Federated Learning,9,2021,NeurIPS,02 Mar 2022
044e13d7dd4e0655eb76f0bd00b2c1bdb44e2be3,Big Bird Transformers for Longer Sequences,352,2020,NeurIPS,02 Mar 2022
0467beadfe444aab86dd22ea8187ab36ae80ff34,Comprehensive Knowledge Distillation with Causal Intervention,0,2021,NeurIPS,02 Mar 2022
0475f61928180c8745c0c7e447ccc157f3b81d99,Asymptotic Guarantees for Generative Modeling Based on the Smooth Wasserstein Distance,9,2020,NeurIPS,02 Mar 2022
04760c886a8e8b980989c608918dfaa8df821d27,Nonparametric Density Estimation under Adversarial Losses,33,2018,NeurIPS,02 Mar 2022
0476d87ae13ec7ee4ef71ccee35dbe4d0dad611b,Logarithmic Regret Bound in Partially Observable Linear Dynamical Systems,34,2020,NeurIPS,02 Mar 2022
047821d6f05b47e587d58f2a4d5a5322600c3008,Breaking the Dilemma of Medical Image to image Translation,4,2021,NeurIPS,02 Mar 2022
047d8f3d626695d93ca7fa3eb32db85f873b3e57,Revisiting 3D Object Detection From an Egocentric Perspective,1,2021,NeurIPS,02 Mar 2022
04818df015fa5671875c4bc9028b8c00a7b2929b,On Separability of Loss Functions and Revisiting Discriminative Vs Generative Models,4,2017,NeurIPS,02 Mar 2022
048478efbd78fb3dbd7042367dadc0014d10f61e,A game theoretic analysis of networked system control for common pool resource management using multi agent reinforcement learning,2,2020,NeurIPS,02 Mar 2022
048a4bad7fbd0cc5068422d0300a83e8f03b078d,Incorporating Context into Language Encoding Models for fMRI,79,2018,NeurIPS,02 Mar 2022
048d8648d85a07d4aa43ee97b9450e6232d95d33,The Power of Predictions in Online Control,17,2020,NeurIPS,02 Mar 2022
049156f03b9eae7a90167d8fce8613a3d1974a59,A Simple Proximal Stochastic Gradient Method for Nonsmooth Nonconvex Optimization,70,2018,NeurIPS,02 Mar 2022
049ce578c4c57897134c2cd566904c25c35f4b5b,Online Linear Optimization with Many Hints,7,2020,NeurIPS,02 Mar 2022
04af50d6895d1146b3bb3f5293d13d6f40f331cf,On the Representation Power of Set Pooling Networks,0,2021,NeurIPS,02 Mar 2022
04c4bc2d9807eb197e4cc1323ac5fd38818c2953,Informative Features for Model Comparison,18,2018,NeurIPS,02 Mar 2022
04ca891f88450a87ae6127d803464ab8d4522cdf,Robust Regression Revisited Acceleration and Improved Estimation Rates,5,2021,NeurIPS,02 Mar 2022
04cafedd3acf13efafcab8521f696bf514f26fab,Probably Approximately Correct Constrained Learning,11,2020,NeurIPS,02 Mar 2022
04ce770dbae1bfdcc66643726324206634d48055,Understanding Regularized Spectral Clustering via Graph Conductance,45,2018,NeurIPS,02 Mar 2022
04d1af916f6a4ebe00cb54e6f410d8193872a03c,The Sample Complexity of Semi Supervised Learning with Nonparametric Mixture Models,1,2018,NeurIPS,02 Mar 2022
04db8098afc524aeeac314f409484de5738b3f18,Multi label Contrastive Predictive Coding,21,2020,NeurIPS,02 Mar 2022
04ef5285380b2a59eb348ca1300db5f4461d8573,Contrastively Disentangled Sequential Variational Autoencoder,1,2021,NeurIPS,02 Mar 2022
04f09054e30f9790fb8c198cdda1b59cb95deef8,When Cyclic Coordinate Descent Outperforms Randomized Coordinate Descent,16,2017,NeurIPS,02 Mar 2022
04f6578eb504155b12a896d9d66b1fc4a3f03231,Adaptive Discretization for Model Based Reinforcement Learning,8,2020,NeurIPS,02 Mar 2022
04f7af2efc330a28a2d5b05f965bb6ee608861a2,The Sparse Manifold Transform,20,2018,NeurIPS,02 Mar 2022
04f8f739924a19c01d196a48783b914554ac0fe5,Convex optimization based on global lower second order models,3,2020,NeurIPS,02 Mar 2022
04fd7de85ce96e82d0286fd8fd6719547bb2842d,Near Minimax Optimal Players for the Finite Time 3 Expert Prediction Problem,9,2017,NeurIPS,02 Mar 2022
04ffb77d7c0861a14323e7b86408db501763acf5,PerspectiveNet A Scene consistent Image Generator for New View Synthesis in Real Indoor Environments,8,2019,NeurIPS,02 Mar 2022
050154e289537735863862d8298c6a2a24779dcb,A Similarity preserving Network Trained on Transformed Images Recapitulates Salient Features of the Fly Motion Detection Circuit,5,2019,NeurIPS,02 Mar 2022
05040b59ce361fb2f3fc3d3e007d5916c7fb31f6,Continuous vs Discrete Optimization of Deep Neural Networks,2,2021,NeurIPS,02 Mar 2022
0513503cb41d0d261edf36a4c5bc99757c3e83ee,Not All Low Pass Filters are Robust in Graph Convolutional Networks,0,2021,NeurIPS,02 Mar 2022
05148f7b04c16e5923cb8736a7ad60ed7aa0edb2,Distributed Zero Order Optimization under Adversarial Noise,3,2021,NeurIPS,02 Mar 2022
051bc84485f0d9be02003e27e0ca67e9a06f2e4d,Deep Learning for Precipitation Nowcasting A Benchmark and A New Model,252,2017,NeurIPS,02 Mar 2022
0531c1524111d9f503e5e079dae73d9933902227,Necessary and sufficient graphical conditions for optimal adjustment sets in causal graphical models with hidden variables,1,2021,NeurIPS,02 Mar 2022
053b1d7b97eb2c91fc3921d589c160b0923c70b1,Learning to summarize from human feedback,66,2020,NeurIPS,02 Mar 2022
053f4d6715a4dba6f8103456fc1bb5fd6a5266c4,Ensemble Distillation for Robust Model Fusion in Federated Learning,104,2020,NeurIPS,02 Mar 2022
0544aa242ec28799351e4bd6ed31bcf1397eaa38,Learning low dimensional state embeddings and metastable clusters from time series data,7,2019,NeurIPS,02 Mar 2022
054b12817fbf2b6b86a8af9d2083e6bcfa01cbd9,Entropy SGD optimizes the prior of a PAC Bayes bound Data dependent PAC Bayes priors via differential privacy,77,2018,NeurIPS,02 Mar 2022
055b0fb969553f84c693cacee7ab9f89966b7a77,Accurate Layerwise Interpretable Competence Estimation,3,2019,NeurIPS,02 Mar 2022
0560c8b2779895a65aef9df83108eb3ae00cd0d4,BlendGAN Implicitly GAN Blending for Arbitrary Stylized Face Generation,2,2021,NeurIPS,02 Mar 2022
0568839fa045769f28d8fe038a4dd707e6531e99,Regret Minimization for Reinforcement Learning by Evaluating the Optimal Bias Function,34,2019,NeurIPS,02 Mar 2022
0572951adde832f6f84e26b5fb87da8e1d1ebca5,SPIDER Near Optimal Non Convex Optimization via Stochastic Path Integrated Differential Estimator,293,2018,NeurIPS,02 Mar 2022
057b594c9e6ed45fc445a4dc45384117bdd15a3e,Provably Powerful Graph Networks,183,2019,NeurIPS,02 Mar 2022
057ce95bd23b2c8c8eac90d02680f7e9828c839b,Nonasymptotic Guarantees for Spiked Matrix Recovery with Generative Priors,4,2020,NeurIPS,02 Mar 2022
058bf3643956e4cc0cdf4e8b671ceda84a34765f,Three dimensional spike localization and improved motion correction for Neuropixels recordings,0,2021,NeurIPS,02 Mar 2022
0597b6577478bfb6f1438a71db38f2f3f348c84f,Variance Reduced Policy Evaluation with Smooth Function Approximation,21,2019,NeurIPS,02 Mar 2022
05989b5397f0a5b8f0e52a842c2c3fd326556e26,Affinity Clustering Hierarchical Clustering at Scale,55,2017,NeurIPS,02 Mar 2022
05a42a1f6263c0e8558b245f1cbfd26221f75ce1,Faster Algorithms and Constant Lower Bounds for the Worst Case Expected Error,0,2021,NeurIPS,02 Mar 2022
05b5ca2e8cc2834de62b7b2e99ab6ea3eb4d5d57,Geometry Aware Recurrent Neural Networks for Active Visual Recognition,23,2018,NeurIPS,02 Mar 2022
05bf1ca3a8a1366970bef3cd9275859e7430ef56,Meta trained agents implement Bayes optimal agents,6,2020,NeurIPS,02 Mar 2022
05c7137c91b192119534f598f3087850bdcae2f7,Testing and Learning on Distributions with Symmetric Noise Invariance,5,2017,NeurIPS,02 Mar 2022
05dd107beb40df099ba83881e4b3e3b277c807f9,Early Stopping for Nonparametric Testing,3,2018,NeurIPS,02 Mar 2022
05ea5e3bbcc22ccf57f9b458ee7d72f9c51682b1,RL Unplugged A Suite of Benchmarks for Offline Reinforcement Learning,16,2020,NeurIPS,02 Mar 2022
05f0113b1bd067ce179ea880f9a4bdcb19920651,Neurosymbolic Transformers for Multi Agent Communication,9,2020,NeurIPS,02 Mar 2022
05f2c16d2e3aee530f5bb16114bcd9fd8f9fa0be,A Comprehensively Tight Analysis of Gradient Descent for PCA,1,2021,NeurIPS,02 Mar 2022
05fdf9587a33f7d69efe6cdfdfe9164a59366e61,Assisted Learning A Framework for Multi Organization Learning,11,2020,NeurIPS,02 Mar 2022
06036f49f15a47842b5dc41ca955976472bb07e8,Chasing Ghosts Instruction Following as Bayesian State Tracking,30,2019,NeurIPS,02 Mar 2022
0611d2f2ea6a3c8fb8534f42758a5a3e9c7bc8fe,Hash Layers For Large Sparse Models,11,2021,NeurIPS,02 Mar 2022
06251e6298a0d3ba3f0a26360c726920c7581575,Overcoming the curse of dimensionality with Laplacian regularization in semi supervised learning,0,2021,NeurIPS,02 Mar 2022
