paperID,title,citations,year,conference,last_updated
71c6301055ab7c55f8c7667c1bebdc087f2d1318,Acceleration via Symplectic Discretization of High Resolution Differential Equations,59,2019,NeurIPS,02 Mar 2022
71d64c24dc0ac9726d2be57f4936ac4528430f64,A Simple Language Model for Task Oriented Dialogue,141,2020,NeurIPS,02 Mar 2022
71d6fdb13095a8c3537444c17257585006c6228f,Dirichlet based Gaussian Processes for Large scale Calibrated Classification,28,2018,NeurIPS,02 Mar 2022
71d976190335a41ed4cf174cdd1390250ef7eb22,Stable and expressive recurrent vision models,16,2020,NeurIPS,02 Mar 2022
71e92abb1e504d56b3f18b4909d73eee3b6048fb,Sobolev Training for Neural Networks,107,2017,NeurIPS,02 Mar 2022
71ea34ce0283ffa46b899dcea5565a2614da5bec,Deep Supervised Discrete Hashing,176,2017,NeurIPS,02 Mar 2022
71ed27bb1facb66ec0a1f9b91e7d0e56e345bbfe,Fully Parameterized Quantile Function for Distributional Reinforcement Learning,38,2019,NeurIPS,02 Mar 2022
71f212b84e8f784bb2c17bf9e2415b0b780f2e73,Spectral Signatures in Backdoor Attacks,228,2018,NeurIPS,02 Mar 2022
71f4e4596e1574e65a70b11aee93ea91e88ffea8,Matching on Balanced Nonlinear Representations for Treatment Effects Estimation,34,2017,NeurIPS,02 Mar 2022
71f6163659726e62a46e0cb72b6572e6d847cdb0,EF21 A New Simpler Theoretically Better and Practically Faster Error Feedback,14,2021,NeurIPS,02 Mar 2022
71fa45d08d858109a6d2819772ef0c646fa6adc5,CBP Backpropagation with constraint on weight precision using a pseudo Lagrange multiplier method,0,2021,NeurIPS,02 Mar 2022
720357653cef655485b7d43f36c17f8692931db6,Neural Similarity Learning,14,2019,NeurIPS,01 Mar 2022
7208279034eba55f9d4aaab9525f5484b434d019,Efficient Algorithms for Device Placement of DNN Graph Operators,19,2020,NeurIPS,02 Mar 2022
720ad49010638bcf93de3a58689de84a047d3040,What the Vec Towards Probabilistically Grounded Embeddings,14,2019,NeurIPS,02 Mar 2022
720ca50d68eaf1f878a0165bdf5e92b8fd10424f,The LoCA Regret A Consistent Metric to Evaluate Model Based Behavior in Reinforcement Learning,3,2020,NeurIPS,02 Mar 2022
723ed1245f5dcdea60b34ba6ccd85afd4c7cc4c0,Geometry Aware Neural Rendering,13,2019,NeurIPS,02 Mar 2022
723f65a5cbd42c33e303a7c3a53fa26d0e10e29f,f Divergence Variational Inference,8,2020,NeurIPS,02 Mar 2022
7245c11b7410c98bfe36070f63ae405ad5c59b8b,Beyond Worst case A Probabilistic Analysis of Affine Policies in Dynamic Optimization,5,2017,NeurIPS,02 Mar 2022
724617ea013bac20be0608b1a0f49d79ba18176d,Identification of Gaussian Process State Space Models,70,2017,NeurIPS,02 Mar 2022
724f81cbc1197c83f546568b2aee2f0b9c4e4fd9,Over parameterized Adversarial Training An Analysis Overcoming the Curse of Dimensionality,21,2020,NeurIPS,02 Mar 2022
7251354318a25b0f304bfe756c8749d492106139,Repeated Inverse Reinforcement Learning,43,2017,NeurIPS,02 Mar 2022
725989041b70ce21c5e20d90037691a59a483257,Counterfactual Contrastive Learning for Weakly Supervised Vision Language Grounding,19,2020,NeurIPS,02 Mar 2022
725c691c1b53d0c132c4b2e8de10f8cc63730813,The Implicit Bias of AdaGrad on Separable Data,12,2019,NeurIPS,02 Mar 2022
726b5a327a1d8bb7af26d9c4a0807d0c8e7e773b,BatchQuant Quantized for all Architecture Search with Robust Quantizer,0,2021,NeurIPS,02 Mar 2022
72701d2af4e7c0a31c168f4136e96adc0a54ba78,Online Adaptive Methods Universality and Acceleration,46,2018,NeurIPS,02 Mar 2022
7270bee98bf9ed9f02037c5149e35d3871ba4c55,Robust and Efficient Transfer Learning with Hidden Parameter Markov Decision Processes,71,2017,NeurIPS,02 Mar 2022
727fbaaa672bf723790d515938cd77c189eb281e,Tensor Programs I Wide Feedforward or Recurrent Neural Networks of Any Architecture are Gaussian Processes,77,2019,NeurIPS,02 Mar 2022
7284fca0eccfd8ef50684b5db5aa39a196e31dba,Concentration of risk measures A Wasserstein distance approach,24,2019,NeurIPS,02 Mar 2022
7285d9755f20d18491b62fa471e633957db02078,Model Based Reinforcement Learning with Adversarial Training for Online Recommendation,25,2019,NeurIPS,02 Mar 2022
7295b27500d6e2dd06bc2f0dfb1a8a0d4b7ab03d,Understanding Weight Normalized Deep Neural Networks with Rectified Linear Units,5,2018,NeurIPS,02 Mar 2022
729a2228220b349ab79e58d4f295d56155d14adf,Adversarial Robustness of Streaming Algorithms through Importance Sampling,10,2021,NeurIPS,02 Mar 2022
729fe230c5a31a6ae083039a218b4038ce029595,Adversarial Blocking Bandits,3,2020,NeurIPS,02 Mar 2022
72a36d61c60d0fb1f08804071db9cbcbf829e084,Average Individual Fairness Algorithms Generalization and Experiments,34,2019,NeurIPS,02 Mar 2022
72a75aeab2c918394dc9af2408fd8e1076ae39ac,Successor Uncertainties exploration and uncertainty in temporal difference learning,23,2019,NeurIPS,02 Mar 2022
72a88d39391df054b1a152b9844fffaf4ccaf067,Stein Variational Gradient Descent as Gradient Flow,125,2017,NeurIPS,02 Mar 2022
72b2e020b32e317c9787e1a79eb7be85ed7f224b,A polynomial time algorithm for learning nonparametric causal graphs,8,2020,NeurIPS,02 Mar 2022
72c093995ca46f430c39e513b65028fb38bec67a,Identification of Conditional Causal Effects under Markov Equivalence,6,2019,NeurIPS,02 Mar 2022
72c142376a39eb53fe2488afe702b21bcf718282,On the Convergence and Sample Efficiency of Variance Reduced Policy Gradient Method,10,2021,NeurIPS,02 Mar 2022
72c85ffe4491abd6f9e537d7dadf8f23c314849e,Learning Attentional Communication for Multi Agent Cooperation,176,2018,NeurIPS,02 Mar 2022
72e0763428b55a788ffa16b7d206f8d3e20a9db9,Distributionally Robust Optimization and Generalization in Kernel Methods,44,2019,NeurIPS,02 Mar 2022
72eb1e76065a20e7c620909b5afde8505b5318dc,Multi Layered Gradient Boosting Decision Trees,72,2018,NeurIPS,02 Mar 2022
72eb42231f3adf5e405657d442acb96eaed1083e,Can Less be More When Increasing to Balancing Label Noise Rates Considered Beneficial,2,2021,NeurIPS,02 Mar 2022
72ede142b4b01c5e3e0db046a8ae539d7b301223,Privately Publishable Per instance Privacy,0,2021,NeurIPS,02 Mar 2022
72ef49faf318047406e3205b48467626851a6928,Continuous Submodular Maximization Beyond DR Submodularity,2,2020,NeurIPS,02 Mar 2022
72f207c777e4a17180cc54ccc6a743d5f43227af,Choose a Transformer Fourier or Galerkin,6,2021,NeurIPS,02 Mar 2022
72f26720dbd47f0ed24413da1b0b2f2c04304c74,Regularizing by the Variance of the Activations Sample Variances,7,2018,NeurIPS,02 Mar 2022
730be081f6e6a0e48402d3a58361821050d822fb,Efficient Variational Inference for Sparse Deep Learning with Theoretical Guarantee,5,2020,NeurIPS,02 Mar 2022
730fdb8604ebad9f90aefeb5a9a806ed7d2097db,Learning Transferable Features for Point Cloud Detection via 3D Contrastive Co training,0,2021,NeurIPS,02 Mar 2022
7323ff36df929ecf1b877c8d0daadffae384c3e3,Simulating a Primary Visual Cortex at the Front of CNNs Improves Robustness to Image Perturbations,52,2020,NeurIPS,02 Mar 2022
73271677da83a3f55523148d1b43a0501f0a35dd,Online Learning in Periodic Zero Sum Games,1,2021,NeurIPS,02 Mar 2022
73317dbc881f53ee7fc25a9899b8b5b6698fce55,Learning Linear Dynamical Systems via Spectral Filtering,66,2017,NeurIPS,02 Mar 2022
7336b10298798985eaa842da38609a3fd0700be3,Self Critical Reasoning for Robust Visual Question Answering,55,2019,NeurIPS,02 Mar 2022
733a3e473bd616c42d21175346963cb727e24d87,Self attention with Functional Time Representation Learning,35,2019,NeurIPS,02 Mar 2022
733dcfafdafd1931154782d7e35e5c08870002dc,Universal Rate Distortion Perception Representations for Lossy Compression,3,2021,NeurIPS,02 Mar 2022
734d45f1f4aa62c9e629df90879fef259f6abbe9,Robust Predictable Control,3,2021,NeurIPS,02 Mar 2022
7359768cdcf4e97bbcc08f1acffad9443936b71e,Fictitious Play for Mean Field Games Continuous Time Analysis and Applications,22,2020,NeurIPS,02 Mar 2022
735ce0447e459e13f89ae751b19323d76a2af786,Program Synthesis and Semantic Parsing with Learned Code Idioms,37,2019,NeurIPS,02 Mar 2022
7363387776d3ce6418cc65dba52e1fa9fa3dad85,Nonuniform Negative Sampling and Log Odds Correction with Rare Events Data,0,2021,NeurIPS,02 Mar 2022
736c551432a27b5302659ab6f284c6ff3dda6e91,Locally Most Powerful Bayesian Test for Out of Distribution Detection Using Deep Generative Models,0,2021,NeurIPS,02 Mar 2022
7372b0a5f456eba1788e9bd5776c1214f9933bc3,Flexible Option Learning,0,2021,NeurIPS,02 Mar 2022
73850f73c24729a97d2a515e4ddf6c69288b5bfd,Consistent Non Parametric Methods for Maximizing Robustness,1,2021,NeurIPS,02 Mar 2022
7389b5776195f41bd681192c44313772c4dd3572,Dual Variational Generation for Low Shot Heterogeneous Face Recognition,32,2019,NeurIPS,02 Mar 2022
739164f224a9c4ad83a6bc80f3c3c8c41f9e11ff,Intra Processing Methods for Debiasing Neural Networks,7,2020,NeurIPS,02 Mar 2022
7396d12b9ff40ab6bef51ac88dc808d5659fb97e,Dynamic Local Regret for Non convex Online Forecasting,4,2019,NeurIPS,02 Mar 2022
739c2181f7894050a06b53b41ac5debe8ffc4829,Hausdorff dimension heavy tails and generalization in neural networks,9,2020,NeurIPS,02 Mar 2022
73b72bf922fd1f5b97fd5b7aa32ce748cad168ac,Communication efficient distributed SGD with Sketching,90,2019,NeurIPS,02 Mar 2022
73baa12a7ab9bf502a677ff0f48608076419b50b,Online Knapsack with Frequency Predictions,0,2021,NeurIPS,02 Mar 2022
73baed8312c002791a3f7a0ce39ead14b7ccf8d5,Learning Multi Agent Communication through Structured Attentive Reasoning,7,2020,NeurIPS,02 Mar 2022
73c418dc78e4675c2bdad4a7757864b1c07c6f92,Learning with User Level Privacy,12,2021,NeurIPS,02 Mar 2022
73c7111c9a269480080a57156398da4c9559b8e9,Distributionally Robust Graphical Models,13,2018,NeurIPS,02 Mar 2022
73d41e90cb85840d860f652a65e5785597d5b698,CLIP It Language Guided Video Summarization,2,2021,NeurIPS,02 Mar 2022
73d5c3cff5a777169dc62d0b351ddcfda503cd33,Reinforced Continual Learning,128,2018,NeurIPS,02 Mar 2022
73d92f96272495d73ead54ea334e1545c2b898aa,Minimax Regret for Stochastic Shortest Path,10,2021,NeurIPS,02 Mar 2022
73dc2ecc962b9bc7c64c32c4a9e68bb621c0863e,Marginal Utility for Planning in Continuous or Large Discrete Action Spaces,0,2020,NeurIPS,02 Mar 2022
73df68c30a51f8b742a48b10b70b61603bbca403,Predicting User Activity Level In Point Processes With Mass Transport Equation,13,2017,NeurIPS,02 Mar 2022
73e3a0370c1229ce1804058e0c048c2dc81ebe9f,Federated Multi Task Learning under a Mixture of Distributions,9,2021,NeurIPS,02 Mar 2022
73f66900af6670d17c3f068eff8419b45937aec6,Dynamic Incentive Aware Learning Robust Pricing in Contextual Auctions,49,2019,NeurIPS,02 Mar 2022
73f95dc930f1583d4e24148961b0aaa3dff80df3,Learning a High Fidelity Pose Invariant Model for High resolution Face Frontalization,49,2018,NeurIPS,02 Mar 2022
73f9efe8cb00414671c0a05be917a0b26b528910,Fast Routing under Uncertainty Adaptive Learning in Congestion Games with Exponential Weights,0,2021,NeurIPS,02 Mar 2022
73fe797b4f4f2d18784246bb74626426a8fe108e,Pointer Graph Networks,10,2020,NeurIPS,02 Mar 2022
740de865b96edafbdf37223a6fff505faa54bb65,Dynamic Influence Maximization,0,2021,NeurIPS,02 Mar 2022
7416930f69bec3d0b712b9dd3b5e7aa6d3dfec58,Soft Calibration Objectives for Neural Networks,4,2021,NeurIPS,02 Mar 2022
741ebf91225327bbd11e0e4fa08e329d45637b13,Optimism in Reinforcement Learning with Generalized Linear Function Approximation,70,2021,NeurIPS,02 Mar 2022
7424478c8c43ff1724a091714fb57f9b3f7f164c,Local Differential Privacy for Evolving Data,36,2018,NeurIPS,02 Mar 2022
74401fab0ed2bff5a4bf31bfae6d408788323970,Reward Propagation Using Graph Convolutional Networks,5,2020,NeurIPS,02 Mar 2022
744139d65c3bf6da6a6acd384a32d94a06f44f62,Reinforcement Learning with Augmented Data,163,2020,NeurIPS,02 Mar 2022
7445966ded8f38cac487314e8c6b71cdf327b047,DRUM End To End Differentiable Rule Mining On Knowledge Graphs,59,2019,NeurIPS,02 Mar 2022
744d510c7afe9730eb54e1dbcc5e84b0116d03df,A Geometric Structure of Acceleration and Its Role in Making Gradients Small Fast,6,2021,NeurIPS,02 Mar 2022
7451d83e3eac30ba719ecea9a051af33dd10fc66,On the Loss Landscape of Adversarial Training Identifying Challenges and How to Overcome Them,19,2020,NeurIPS,02 Mar 2022
7455600913d15f202008e57b46459527a6ecc7d7,SLOE A Faster Method for Statistical Inference in High Dimensional Logistic Regression,0,2021,NeurIPS,02 Mar 2022
745c614dbd23bc1e3def79f600680b88cee28700,Thinking Fast and Slow with Deep Learning and Tree Search,204,2017,NeurIPS,02 Mar 2022
74799e4471e905b7fb62013b3c7c5c8c5c9a8ca2,Zero Shot Transfer with Deictic Object Oriented Representation in Reinforcement Learning,3,2018,NeurIPS,02 Mar 2022
7479c0fd4e5399bc5abeeb1dfc887355289e91a2,Asynchronous Coordinate Descent under More Realistic Assumptions,50,2017,NeurIPS,02 Mar 2022
7483bf843939c3f6aa2189c6f2f5c69dabeeb20d,Habitat 2 0 Training Home Assistants to Rearrange their Habitat,29,2021,NeurIPS,02 Mar 2022
748a5b67ec0f26216cabe427f8bd493bd8aade8d,Scalable Bayesian dynamic covariance modeling with variational Wishart and inverse Wishart processes,5,2019,NeurIPS,02 Mar 2022
748db15cc75d5c0bd95761d6a525a003f873914b,Sparse PCA from Sparse Linear Regression,4,2018,NeurIPS,02 Mar 2022
748dc54a89a276639f9d571cdd8e7d1ae3f9a57a,Explanations based on the Missing Towards Contrastive Explanations with Pertinent Negatives,263,2018,NeurIPS,02 Mar 2022
7490d73dc5ba02204407bb6ef630d2e8ec47bb4f,MOPO Model based Offline Policy Optimization,170,2020,NeurIPS,02 Mar 2022
749b9b862c4dc1293b9ebf0c4265df34abf7afde,Factored Bandits,6,2018,NeurIPS,02 Mar 2022
749d4dbe27b1a587c8827af6659e954db8081080,Interpolated Policy Gradient Merging On Policy and Off Policy Gradient Estimation for Deep Reinforcement Learning,125,2017,NeurIPS,02 Mar 2022
74a3721cb5bdafc3c9671ace6cc8d94510e5449f,Implicit Bias of SGD for Diagonal Linear Networks a Provable Benefit of Stochasticity,4,2021,NeurIPS,02 Mar 2022
74a3f14db41653b1d5daca2b9caf348d2bb90bf4,Shared Space Transfer Learning for analyzing multi site fMRI data,3,2020,NeurIPS,02 Mar 2022
74a53a386661ae9d259ef68b40ed622c2b64edc8,Bayesian Inference of Individualized Treatment Effects using Multi task Gaussian Processes,155,2017,NeurIPS,02 Mar 2022
74ac6cc0de62c279d78f1ae1c374f0cfc8647236,Exploiting Numerical Sparsity for Efficient Learning Faster Eigenvector Computation and Regression,4,2018,NeurIPS,02 Mar 2022
74b5515ada5667f02f3b198eeb726b5cd347708f,Post Device Placement with Cross Entropy Minimization and Proximal Policy Optimization,13,2018,NeurIPS,02 Mar 2022
74bb19d1ce2ec9fb9605545a750e68281a067e63,A NeRF Articulated Neural Radiance Fields for Learning Human Shape Appearance and Pose,8,2021,NeurIPS,02 Mar 2022
74cffef42937051f3d480ea889c271a99e8050b6,Closing the Dequantization Gap PixelCNN as a Single Layer Flow,8,2020,NeurIPS,02 Mar 2022
74d09f67270d66329abbb9640b1cc1e672600fa2,Individual Privacy Accounting via a Renyi Filter,20,2021,NeurIPS,02 Mar 2022
74e24fa1628780d269ba7bff7237f7ac1fccea7e,A generative nonparametric Bayesian model for whole genomes,2,2021,NeurIPS,02 Mar 2022
74e6731454e9eea81943c1e90c4042eefa350cc1,Generative View Synthesis From Single view Semantics to Novel view Images,4,2020,NeurIPS,02 Mar 2022
74fe761a1e762c004c5bbde4612a75dc54111552,Deep Variational Instance Segmentation,3,2020,NeurIPS,02 Mar 2022
74ff250bbf6495ac65f2d52558d413f723f1bd4c,Interventional Sum Product Networks Causal Inference with Tractable Probabilistic Models,4,2021,NeurIPS,02 Mar 2022
7501c2fcf7b2db9381dfdf00743a97e0120f1e04,Don t take it lightly Phasing optical random projections with unknown operators,7,2019,NeurIPS,02 Mar 2022
7502bf121c7103660b3f7ff1b5033b705263c246,Residual Pathway Priors for Soft Equivariance Constraints,1,2021,NeurIPS,02 Mar 2022
7504fb75de24dde8ca6d59ca6178d90d8a87242a,Improved Algorithms for Collaborative PAC Learning,10,2018,NeurIPS,02 Mar 2022
7509c66a666e2e3f14bc8676b969b945ee6e136f,CAPE Encoding Relative Positions with Continuous Augmented Positional Embeddings,4,2021,NeurIPS,02 Mar 2022
750fbba3e7545ee8eb73c549a6f4d92ea0521386,Set2Graph Learning Graphs From Sets,14,2020,NeurIPS,02 Mar 2022
751201109e644e1422d025fe8433f29570997b7d,Mean Field Residual Networks On the Edge of Chaos,130,2017,NeurIPS,02 Mar 2022
752afa8e951c21b52a8288700b8760e22dd1dd52,DeepReduce A Sparse tensor Communication Framework for Federated Deep Learning,1,2021,NeurIPS,02 Mar 2022
752f6f980540374d7030e90afb8fec9484b546e5,Meta Learning to Improve Pre Training,1,2021,NeurIPS,02 Mar 2022
75437ae4cf8c8c04d68a9063440f802d211197d9,RED Looking for Redundancies for Data Free Structured Compression of Deep Neural Networks,1,2021,NeurIPS,02 Mar 2022
75458574beb2db3fa64e556a09a04c1d59a02783,"What can linearized neural networks actually say about generalization ",3,2021,NeurIPS,02 Mar 2022
755afef746282ebd974eeed5e9e78b473f4a587d,Unsupervised Foreground Extraction via Deep Region Competition,0,2021,NeurIPS,02 Mar 2022
7566972a2284e2af36139e061ae984edae8b4593,Learning Macroscopic Brain Connectomes via Group Sparse Factorization,0,2019,NeurIPS,02 Mar 2022
756eac52299df7c1e525e72bb53a6e0ececdcf01,You are caught stealing my winning lottery ticket Making a lottery ticket claim its ownership,2,2021,NeurIPS,02 Mar 2022
757a33f5c440f681c76d02d221281e82da66a27b,Neural Architecture Generator Optimization,16,2020,NeurIPS,02 Mar 2022
757c10df5c5a60539cf745309a64949c7a79b046,The Causal Neural Connection Expressiveness Learnability and Inference,8,2021,NeurIPS,02 Mar 2022
757d4272e52f3312e3f31709698602ae8fe46737,Fault Tolerant Federated Reinforcement Learning with Theoretical Guarantee,2,2021,NeurIPS,02 Mar 2022
7585308167bed4566147e6401232c8611264a4c1,Minibatch and Momentum Model based Methods for Stochastic Weakly Convex Optimization,1,2021,NeurIPS,02 Mar 2022
75882e80112716c1e0f453682f66eb632d28de65,Adaptive GNN for Image Analysis and Editing,0,2019,NeurIPS,02 Mar 2022
758ba118d7f161fe019d81c4f64a9069c342aa74,Simple random search of static linear policies is competitive for reinforcement learning,129,2018,NeurIPS,02 Mar 2022
7593b179415381768c12b3cec2f2d12e5820a909,Differentially Private n gram Extraction,1,2021,NeurIPS,02 Mar 2022
7596030e0ce7a8df2f43e6ba4e9de5fa4a19240f,Explore Aggressively Update Conservatively Stochastic Extragradient Methods with Variable Stepsize Scaling,22,2020,NeurIPS,02 Mar 2022
759ae1234d46e2d1399ce9d642724738a766ed22,Meta Gradient Reinforcement Learning with an Objective Discovered Online,24,2020,NeurIPS,02 Mar 2022
759af360f450ef76d903a907e8a39b10845cdeaf,Meta Learning Requires Meta Augmentation,19,2020,NeurIPS,02 Mar 2022
75a060752996ec8b27b791a9084b171bc8b4d777,Structured Denoising Diffusion Models in Discrete State Spaces,18,2021,NeurIPS,02 Mar 2022
75a6741a56fb2150c148861cbf8b4da766b73daa,Cooperative Stochastic Bandits with Asynchronous Agents and Constrained Feedback,2,2021,NeurIPS,02 Mar 2022
75ad7fe9b7590c34009d99d4c4065d2250afa11b,Learning under Model Misspecification Applications to Variational and Ensemble methods,20,2020,NeurIPS,02 Mar 2022
75b32165fd7d2aa2f9881005db72d5cea1b94d4a,The Limit Points of Optimistic Gradient Descent in Min Max Optimization,156,2018,NeurIPS,02 Mar 2022
75b513d927e7a306fb70d8be84af57e8bbe24b32,Orthogonally Decoupled Variational Gaussian Processes,28,2018,NeurIPS,02 Mar 2022
75c6ee0ddad05b752252f57e8dc1ede18ac13f63,Distributional Reinforcement Learning for Multi Dimensional Reward Functions,0,2021,NeurIPS,02 Mar 2022
75cba667e44b8c61decd3e6eff52ca16db4af857,Finite Continuum Armed Bandits,0,2020,NeurIPS,02 Mar 2022
75ce17ebfbba0506b568904347586248cad9e9be,Content Provider Dynamics and Coordination in Recommendation Ecosystems,1,2020,NeurIPS,02 Mar 2022
75d12de403ea806f2de31b2cf7b78f05bd631fc2,Neuron matching in C elegans with robust approximate linear regression without correspondence,4,2017,NeurIPS,02 Mar 2022
75d33c125eba966b50d4dccd359a2f6aa4e0e2e7,Off Policy Risk Assessment in Contextual Bandits,2,2021,NeurIPS,02 Mar 2022
75dafecd481f134d4f8b9afb4923b35184d3c971,MetaGAN An Adversarial Approach to Few Shot Learning,205,2018,NeurIPS,02 Mar 2022
75e1099394549f005e703048b2b0a0d51c901b53,Optimistic optimization of a Brownian,3,2018,NeurIPS,02 Mar 2022
75f564cdfdc681f12fd1ae48be2b8217d5d83ebd,Sharp Bounds for Generalized Uniformity Testing,13,2018,NeurIPS,02 Mar 2022
75f7228bb7a12d16150fd78d84527b3703648829,Uniform Error Bounds for Gaussian Process Regression with Application to Safe Control,44,2019,NeurIPS,02 Mar 2022
75f83ddd1bc9fa940f7cb3cd8b0a13df94641701,Constrained Robust Submodular Partitioning,0,2021,NeurIPS,02 Mar 2022
75fdc13ef0942820dad5471e5c7257f51c2c6618,Distributional Reward Decomposition for Reinforcement Learning,4,2019,NeurIPS,02 Mar 2022
7606e7116ecf378c1a272f01f835cef1a25a6010,Policy Optimization in Adversarial MDPs Improved Exploration via Dilated Bonuses,5,2021,NeurIPS,02 Mar 2022
760fe521c4c2bb647bdacc7c43866cbc658094ee,Low Complexity Nonparametric Bayesian Online Prediction with Universal Guarantees,0,2019,NeurIPS,02 Mar 2022
761e530efea87acab453e6ca9b3926bc83e39ccd,On the Optimal Weighted ell 2 Regularization in Overparameterized Linear Regression,37,2020,NeurIPS,02 Mar 2022
761fcac6442745628d5bfd7feed1d1d34aebb06f,Reducing Information Bottleneck for Weakly Supervised Semantic Segmentation,0,2021,NeurIPS,02 Mar 2022
762869daa7da296b795798d41a46a2d87cacf64c,Progressive Feature Interaction Search for Deep Sparse Network,0,2021,NeurIPS,02 Mar 2022
76305acf2bf94e3a5677f7547098eeffb6649706,Neural Bellman Ford Networks A General Graph Neural Network Framework for Link Prediction,4,2021,NeurIPS,02 Mar 2022
7634b0cf93169d2a95d4d7193f47f97a61e3b4b2,Game Design for Eliciting Distinguishable Behavior,0,2019,NeurIPS,02 Mar 2022
76768c1ee0d7ff6d7c1c944c0048fb31ccc608df,Unsupervised Motion Representation Learning with Capsule Autoencoders,2,2021,NeurIPS,02 Mar 2022
767e50c134f136784aeee75b1448c947e19bf6ad,Sparse Symplectically Integrated Neural Networks,6,2020,NeurIPS,02 Mar 2022
7691edb9f5f0fe6ccb15d4a75935fd658190066c,Integrating Bayesian and Discriminative Sparse Kernel Machines for Multi class Active Learning,5,2019,NeurIPS,02 Mar 2022
769533a5f3ecf694ef597797fdcb15c10ca3e9dc,A Bandit Learning Algorithm and Applications to Auction Design,1,2020,NeurIPS,02 Mar 2022
769fda115ef543b048853bdfaa78efedbe8bc58b,Bootstrapping Neural Processes,3,2020,NeurIPS,02 Mar 2022
76b2e02295902dbfd601e33e4fb9265db8d544cf,Delay and Cooperation in Nonstochastic Linear Bandits,8,2020,NeurIPS,02 Mar 2022
76bef3dae6f7c48de92b7346365759664acfd5db,"Breaking the centralized barrier for cross device federated learning ",1,2021,NeurIPS,02 Mar 2022
76bffc0859d0232b05b17e1c22aa4d46e64fbf87,A unified variance reduced accelerated gradient method for convex optimization,36,2019,NeurIPS,02 Mar 2022
76c2a2b883b3a801b16b8765eb54ab61a63f405c,Boosted CVaR Classification,1,2021,NeurIPS,02 Mar 2022
76d5f7120eca7a2745718b474570b9201b090adb,Controlling Neural Networks with Rule Representations,0,2021,NeurIPS,02 Mar 2022
76e27fda169e16f56673316937fadefe5f425518,A novel notion of barycenter for probability distributions based on optimal weak mass transport,1,2021,NeurIPS,02 Mar 2022
76ec6e650b520f14a83a65a91e3f8a20d65794ff,A Unified Framework for Data Poisoning Attack to Graph based Semi supervised Learning,30,2019,NeurIPS,02 Mar 2022
76f37e89783354abead1970c2f8d49729cbd9cdf,The Devil is in the Detail A Framework for Macroscopic Prediction via Microscopic Models,3,2020,NeurIPS,02 Mar 2022
76fbecc05f3060ddcbbf65fb6d1305a1278119c7,ResT An Efficient Transformer for Visual Recognition,20,2021,NeurIPS,02 Mar 2022
770538e506051da89f57f48062db8f374ebf2334,Meta Curvature,42,2019,NeurIPS,02 Mar 2022
7706a6aa39fedb5cff6c954d81a825b140216240,Curriculum guided Hindsight Experience Replay,39,2019,NeurIPS,02 Mar 2022
770a4ad9f0b4dd4eeb8ccc8baa0b376af9a0a773,Gradient Free Adversarial Training Against Image Corruption for Learning based Steering,1,2021,NeurIPS,02 Mar 2022
77119c507e9bb041fa06452ee193208b690cc9c3,Information Theoretic Counterfactual Learning from Missing Not At Random Feedback,8,2020,NeurIPS,02 Mar 2022
77134d25671538709d5f5d2bc22a9f9ba6265b35,Learning Mixture of Gaussians with Streaming Data,6,2017,NeurIPS,02 Mar 2022
7717e17df9e6f83fb17f3dbcd6189a4cbeb359b7,Scattering GCN Overcoming Oversmoothness in Graph Convolutional Networks,29,2020,NeurIPS,02 Mar 2022
77320ccfac7bca6f535a8da87d427451c4d7425e,Multiple Descent Design Your Own Generalization Curve,32,2021,NeurIPS,02 Mar 2022
773d5ddc414424a8948446ddaa5275b944f50891,Learning to Prune Deep Neural Networks via Layer wise Optimal Brain Surgeon,245,2017,NeurIPS,02 Mar 2022
774295eec4466aff34247e6ba0e06682817d7ded,Post Training Sparsity Aware Quantization,2,2021,NeurIPS,02 Mar 2022
7748560473f7f7f170cf6f6adec0a581014637b8,Effective Parallelisation for Machine Learning,9,2017,NeurIPS,02 Mar 2022
7750a706a140f63a28dd3903b9a187647bf38d39,Evolving Graphical Planner Contextual Global Planning for Vision and Language Navigation,19,2020,NeurIPS,02 Mar 2022
7754c2c7a7b1087c1534116c7fd4b1d419ae774d,Acceleration and Averaging in Stochastic Descent Dynamics,14,2017,NeurIPS,02 Mar 2022
775a6e0f9104b282ed867871d743e3afd1e66d96,Nested Graph Neural Networks,2,2021,NeurIPS,02 Mar 2022
77627cbe633b7ac8bd89ffca87074d52501ea2cb,A Multi Implicit Neural Representation for Fonts,0,2021,NeurIPS,02 Mar 2022
77706ee4cbdbb23345da22af37bc1b9f5ec8f110,Sub Linear Memory How to Make Performers SLiM,5,2021,NeurIPS,02 Mar 2022
77774a7a123460ad58faee490d4751e8f17a7a58,An Ode to an ODE,8,2020,NeurIPS,02 Mar 2022
7786215ff12d2b49f7e8e251016142c5ea1764fa,Fair Performance Metric Elicitation,6,2020,NeurIPS,02 Mar 2022
77899bac8f463b7a77c0c282748e989d419386e7,Semi Supervised Learning with Declaratively Specified Entropy Constraints,4,2018,NeurIPS,02 Mar 2022
779242114325489cd91e79a0abd162883eef66eb,DetNAS Backbone Search for Object Detection,127,2019,NeurIPS,02 Mar 2022
7794f33c249e0b8dd2d4c9716dafa32e8c5dfa18,Metric Free Individual Fairness in Online Learning,9,2020,NeurIPS,02 Mar 2022
779a5c171e10ff9427e7a96a0905c239fbc420d0,Procrastinating with Confidence Near Optimal Anytime Adaptive Algorithm Configuration,14,2019,NeurIPS,02 Mar 2022
